ID	Transcription
281474976724563	ऊ शायद कल आवय ।
281474976724564	हम सब मा तू सबसे अच्छा इन्सान अहा ।
281474976724565	उ स्कूले जाब काहे बरे छोड दिही से ।
281474976724566	वे सब अपने-अपने गाँव चला गये हें ।
281474976724567	कृपा कयके आप हियाँ से जाय ।
281474976724569	ऊ अब अपने घरे पय होये ।
281474976724364	हम वहिका कल बच्चा देबय ।
281474976724365	हम लडकी का कामवाली से कमरा साफ़ करय के बरे बोले हे ।
281474976724366	वहिका जाय दिया ।
281474976724367	पिछले सप्ताह मा ऊ दिल्ली जाय चुका रहन ।
281474976724368	राधा के चक्कर मा ऊ मर गवा ।
281474976724369	ऊ अब मैदान जात बाटय ।
281474976724370	के खुद कय प्रशंसा करा थय जे खुद कय प्रशंसा करा थय ।
281474976724371	हम नाव से आइन्हे ।
281474976724297	राधा चावल धीरे खा ।
281474976724320	हमका नही लागत अब ऊ आये ।
281474976724352	हम वहिका एक किताब देत अही ।
281474976724363	सब लडकियय कक्षा मा आई ही ।
281474976724442	तु हमरे साथे आवत अहा ना ।
281474976724458	वे अब बाँस काटत अहय ।
281474976724506	जहाँ-तहां किताब सब पडी अहय ।
281474976724507	राधा रमेश के साथ गईं शहर ।
281474976724508	हम वहिका एक बच्चा देत अही ।
281474976724509	हमार बहिनिया विद्यालय मा अहय ।
281474976724510	उ रोजय बजार जा थय ।
281474976724512	ऊ पत्थर तोड दिही से ।
281474976724513	कुछ लरिका कक्षा मा नही आये ।
281474976724514	दरवाजवा अपने आपय खुल गा ।
281474976724515	वे लोग हमसे प्यार करा थीं ।
281474976724516	वे बजार जइहैं ।
281474976724517	किसान कुदार-उदार लैके खेते जात अहय ।
281474976724519	का तू घरे जाबा ।
281474976724520	ऊ खाली अपने परिवार के बरे काम करति अहय ।
281474976724521	महतारी नौकरानी से लरिकन का खाना खावावाई ।
281474976724330	तोहार घर कहाँ है ।
281474976724331	वे हमका कल आशीष देहे हे ।
281474976724332	हमरे लगे पैसा नही अहय ।
281474976724336	हम उनका सुम्मार का घरे से बाहर लै जावा चाही थे ।
281474976724337	वह सोय गय रही ।
281474976724339	टैँक मा पानी नही अहय ।
281474976724340	हम कतहूँ जाय सकी थे ।
281474976724341	हम उनका एक बच्चा देत रहे हे ।
281474976724421	ऊ शादी के बरे एक लडकी देखे रहा ।
281474976724423	हम अब वोहसे नही मिली थे ।
281474976724424	मजदूरन का घर बनावय के बरे पचास पत्थर कय जरुरति अहय ।
281474976724425	ऊ हाथी मारय कय कोशिश करी से ।
281474976724426	उ अब स्कूल जात अहय ।
281474976724427	ऊ आपन सगाई तोड दिहिस ।
281474976724428	राधा सीता से कही की राखी खुद का बहुत पसन्द करा थीं ।
281474976724430	तु रोजय चावल खा थ्या ।
281474976724431	रूबी सबसे तेज दौडा थे ।
281474976724607	तू येहका बच्चा देत अहा ।
281474976724608	नदिया मा पानी नही अहय ।
281474976724609	तोहार घरा कौन आय ।
281474976724610	हम एक मेला का जात अही ।
281474976724611	सूरज पूरब दिशा मा उअगर है ।
281474976724613	राधा अबेन अबे घर छोडे ।
281474976724614	बरसात होत रही यही बरे हम खेते नही जाय पाये हे ।
281474976724615	ई पटरवा बहुत मोट अहय ।
281474976724401	पाती पेडे से नीचे गिरति अहय ।
281474976724402	का तू हमका नही जनत्या ।
281474976724403	ऊ दुपहरिया मा गाये अब ।
281474976724404	उ तनी के देरी पहिले चावल खाई से ।
281474976724405	बिना केहू का बताये चला गवा ।
281474976724406	उ सच नही बोलत अहय ना ।
281474976724407	अगर बरसात होये तव हम चिकन बनाउबय ।
281474976724409	चिडिया पेडे पय नही अहय ।
281474976724410	उ घरे मा होये ।
281474976724584	तू वोहका किताब देहे रह्या हा ।
281474976724585	हमरे घरे मा एक कुकुर अहय ।
281474976724586	उ घूँट-घूँट कयके पानी पी गवा ।
281474976724588	हम वोकरे भाई का देखी ने ।
281474976724589	तू केहका परिसिन्द करा थ्या ।
281474976724590	उ जंगले मा अहय ।
281474976724591	बप्पा अपने लरिकन का केलाउना खरीदा थीं ।
281474976724593	आज सुम्मार आय ।
281474976724595	मौसम खराब रहन यही वजह से हम सब जने गाँव का नही जाय पाइन ।
281474976724486	ऊ हंसत-हँसत पागल होय गवा ।
281474976724487	ऊ चावल खाये ।
281474976724488	निचवा दीन उदाहरण कय उत्तर बतावा ।
281474976724489	हम हुअन नही जाय सकित ।
281474976724490	पेडे पर बान्दर अहय ।
281474976724491	सूरज पूरुब दिशा से उगत अहय ।
281474976724492	वह वोहका एक बच्चा दे ।
281474976724493	हमार बहिन हमरे विश्वास नही किहिस ।
281474976724494	लरिकवा सोय चुका अहय ।
281474976724496	तू बस नम्बर पैसठ लय सका थ्या गाँव जाय के बरे ।
281474976724313	राधा वोतनिन नीकी अहय जेतना की रूबी ।
281474976724314	हम खुद का आइना मा देखी ने ।
281474976724315	सब जने परीक्षा पास नही करे ।
281474976724316	राधा अव राजा एक दूसरे का देखें ।
281474976724317	वे फ़ुटबाल रोजय खेला थीं ।
281474976724318	राजा आपन घर छोडे ।
281474976724319	पिछले साल अक्टूबर महीना मा बरसात भय रही ।
281474976724536	ऊ वोहका किताब देत अहय ।
281474976724537	वे रोजय बजार जा थे ।
281474976724538	टीटू खाना बनावति अहय ।
281474976724539	हमका नही पता है ।
281474976724540	राजीव टोटुवा सब लम्बा अहय ।
281474976724541	ना हम ना तू यह मुसीबत का हल कय सका थ्या ।
281474976724542	हमसे बिना पूछे अन्दर ना करया ।
281474976724543	हम एतुआर का कलकत्ता जाबय ।
281474976724544	उ दिल्ली अकेले जाय स्का थय ।
281474976724545	कुकुर लरिका का रोवाय दिही से ।
281474976724546	टोटो कैसे गिर गवा ।
281474976724355	कलकत्ता मा सब देशन से अच्छी मिठाई मिला थय ।
281474976724356	ऊ कल तक आपन काम समाप्त कय चुका होये ।
281474976724359	राधा वोतय नीकी अहय जेतनी की रूबी ।
281474976724360	ऊ अबे स्कूल जाति अहय ।
281474976724361	हम रोजय मैदान का जाई थे ।
281474976724362	ऊ कमरा का साफ़ करिस ।
281474976724443	ऊ तीन ठी सुअर घरे के पिछवारे रक्खा थय ।
281474976724444	डाकुअय घरे का जलाय देहे ।
281474976724446	हम जात अही ।
281474976724447	वोहकय नाम कृष्णा है ।
281474976724450	मधु अपने बहिनी से जादा सुन्दरी अहयं ।
281474976724452	उ एक अध्यापिका आय ।
281474976724454	उ घरे मा रहा नय ।
281474976724455	अब हम वोहका किताब देत अही ।
281474976724457	हम कल नही खाये रहे हे ।
281474976724627	लरिका स्कूल जात अहय ।
281474976724628	ऊ बिहान कलकत्ता जाये ।
281474976724629	केहू आपन तारिफ़ नही करत ।
281474976724631	कृपा कयके दरवाजा खोलय ।
281474976724632	लरिका चुपचाप सोवत अहय ।
281474976724633	सही-सही कही तव हमका चाय नही पसन्दी अहय ।
281474976724634	उ हियन नही अहय ।
281474976724637	उ कल कलकत्ता जाती अहयं ।
281474976724381	कल दस बजे सबेरे ऊ हियाँ होये ।
281474976724382	हम वहिका रोज किताब दी थे ।
281474976724383	कुर्सी लरिकन के द्वारा तोडी गय अहै ।
281474976724384	कल ऊ रात मा चावल खाये ।
281474976724385	राधा का केतनी रुपिया मिली ।
281474976724386	हमरे भूख नही अहय ।
281474976724387	शायद ऊ कल सुबेरे जलदी आये ।
281474976724388	हमका जाय दियय अउर आप चाय पियय ।
281474976724390	हमरे दादी अम्मा हमका बहुत सारा बिस्कुट दिहीं ही ।
281474976724473	उ कल नगर का गा रहा नय ।
281474976724474	हमरे भूख नही लागी अहय ।
281474976724475	ऊ गाय नही सकतय ।
281474976724476	हम जाबय जब अम्मा अहै तव ।
281474976724477	हम तेजी से भागी थे ।
281474976724478	ऊ कलकत्ता से आये ।
281474976724479	अब हमका खाय का होये ।
281474976724480	काश हम आय पाइत ।
281474976724481	राजा अपने मेहरारू का फ़ूल देहे हे ।
281474976724483	चले जाओ ।
281474976724484	हमका लागत थय ऊ ना आये ।
281474976724485	वोकरे बिमारी के बारे मा कुछु नही किन जाय सकत ।
281474976724524	अगर तू पढब्या ना तौ फ़ेल होय जाब्या ।
281474976724526	ऊ नीचे गिर गवा ।
281474976724527	कल सुबेरे ऊ जग़ल जात रहन ।
281474976724528	हम वोहकय मूड खच्च धे काट दिहिन ।
281474976724529	उ कल नगर गवा ।
281474976724530	सीता अव राजा का लाग की वे एक दूसरे से लडत अहय ।
281474976724533	बार-बार वोहका भूत देखान है ।
281474976724534	ऊ दिल्ली जाये ।
281474976724535	वह एक मनई देखी से ।
281474976724298	का तू अबहिन आय सका थया ।
281474976724299	हम आज रात का शहर जावा चाही थे ।
281474976724301	मधु अपने लरिकन का बहुत प्यार करा थीं ।
281474976724305	ई बाँस कय रस्सी आटय ।
281474976724307	कल वे चोर पकड लेहे रहे हे ।
281474976724308	टेबल पय दुय किताबी अहय ।
281474976724309	कौनव लरिकय नही आये ।
281474976724310	अगर वे कल आवा होते तव हम त्योहार मनाय सकत रहे हे ।
281474976724548	लरिका जलदी जलदी चलत अहय ।
281474976724551	हम अबे तक्का नही खाये अही ।
281474976724552	तोहार नाम काव अहय ।
281474976724554	हर मनइन का दस रुपिया दिया ।
281474976724555	हमरे परिवरवन मा हर एक मनई के लगे मुर्गा मुर्गी अहय ।
281474976724556	कुकुर भौंकत अहय ।
281474976724413	वे चल दिये होते तव सही रहतय ।
281474976724414	उ देखिस कि वे सब पत्थर से खेलत अहय ।
281474976724415	हियां धुम्रपान निषेध अहय ।
281474976724416	हम शराब नही पीत ।
281474976724417	हम खुद का पसन्द करी थे ऊ खुद का पसन्द नही करतय ।
281474976724418	उ उछल कूद के अपने घरे पहुँच गा ।
281474976724419	वे सब अपने बारे मा हमका बताये ।
281474976724641	ऊ खाँसत-खाँसत मरी गवा ।
281474976724642	मेजिया पय दस किताबी अहय ।
281474976724643	उ वोहका किताब देत अहय ।
281474976724644	हम बसे से अउबय ।
281474976724645	हम ई नही कहिन कि ऊ खराब अहय ।
281474976724646	उ कहिस की औरत जमीन पय सोवति अहय ।
281474976724647	ऊ घरे मा रहन ।
281474976724596	का ई तोहरे बरे सही रहे ।
281474976724597	उ गुरू जी ना हुअय ।
281474976724599	हम गिर गइन जब हमका एक कार टक्कर मारी से तव ।
281474976724600	उ एक बहिन जी अहीं ।
281474976724601	उ घर केकर आय ।
281474976724432	आपन खाना खाये के बाद उ सोवय चला गवा ।
281474976724433	उ गेंद का मारी से ।
281474976724434	तू वोहका रोज किताब दे थ्या ।
281474976724436	ऊ हमरे सम्प्रदाय कय मुखिया आटय ।
281474976724438	तुहका अब हिलय का नही चाही ।
281474976724439	छात्रन का डंडी से ना पीटा ।
281474976724440	सब लडकिन मा ऊ सबसे सुन्दरी अहय ।
281474976724441	हम कल वोहिका बच्चा देबय ।
281474976724571	उ सोवत अहय ।
281474976724572	अगर अच्छी बरसात होय जाये तव अच्छे से खेती होये ।
281474976724573	हम चलय नही पाइत अहय ।
281474976724574	हम अउर हमार भाय दुइनौ जने साथे खेलबय ।
281474976724575	आया लरिकन का खाना खावाय दिहिस ।
281474976724576	हमरे पथरे कय घर बनाये अही ।
281474976724577	का तू वोहका देखे नही अहा ।
281474976724578	घरे-घरे जाय के हम जलावन एकट्टा करे हे ।
281474976724579	ऊ हमसे प्यार करा थय ।
281474976724580	राधा हमका लाते से मारीं अउर भग गई ।
281474976724581	ऊ छते पय भाग गय ।
281474976724582	ऊ कपडा धोवति अहय ।
281474976724322	तुहका कय गाय चाही ।
281474976724323	उ मरी गा ।
281474976724324	वे एक दूसरे कय राह देखा करा थीं ।
281474976724326	हमका केहू नही देखी से ।
281474976724327	हम वहिका कल किताब देबय ।
281474976724328	बहुत नीक गावा थय ।
281474976724329	थोडा चाय वाय लै लिया करा ।
281474976724617	काल्ह यह समय तक्का उ कलकत्ता पहुँच गय होये ।
281474976724618	हमरे अडोसी-पडॊसी बहुत नीक अहय ।
281474976724619	हमरे माई बहुत धीरे-धीरे खाना खा थीं ।
281474976724620	हम चाही थे की ऊ रोज खेते मा जाय ।
281474976724621	अंदर ना हिला ।
281474976724622	भारत मा सबसे बडी नदी गग़ा नदी अहय ।
281474976724623	ऊ दुई दिन पहिले बाक्स खोली से ।
281474976724624	उ हमका फ़ोन करे ।
281474976724625	वे राधय अही जौन खइहै ।
281474976724498	तू कल शहर गा रह्या हा ।
281474976724499	उ कुल्हरी से पेड काटी से ।
281474976724500	दूर होय जा हियाँ से ।
281474976724501	तू रोज वोहका बच्चा दिया ।
281474976724502	उ दूध वुध खरीदे ।
281474976724503	ऊ धडाम से गिर गवा ।
281474976724504	ऊ कल नगर गा रहा नय ।
281474976724505	जात नम्बर से ।
281474976724343	वे लोग आपन काम खतम नही करे ।
281474976724345	रमेश दौडत अहय ।
281474976724346	राधा अपने बरे एक साडी खरीदी ही ।
281474976724347	इ बोटा आटय ।
281474976724348	हम आज नही खेले हे ।
281474976724350	हमरे लगे पैसा ना होतय तव हम चल सकत रहे ।
281474976724391	हम कल स्कूल ना जाबय ।
281474976724394	उनका सबका रस्स्सी से बांध दिया ।
281474976724396	हम सुबेरे चावल बनाये हे ।
281474976724288	आरी बगली दूर दराज के सब लोग सभा मा पहुंच गये ।
281474976724289	कृपा कय दियय जायं ।
281474976724290	हम अब बजारे जात अहीं ।
281474976724291	हम हर दिन चलत-चलत थक गा अही ।
281474976724293	हम दुइनौ एक दूसरे से मिले ।
281474976724294	हम लोगन का बिजली तार कय जरुरति अहय ।
281474976724295	इ लम्बा पेड अहय ।
281474976724522	हमरे घरे मा बहुत ढेर के पेड अहय ।
281474976724547	टीटो राधवा का सोवायेहे ।
281474976724557	ऊ घरे मा अहय ।
281474976724583	लोग हियाँ एकट्ठा भा हय ।
281474976724605	हमका आम अच्छा नही लागत ।
281474976724616	तू अबना जाय सकब्या ।
281474976724626	हम लडकी से कमरा साफ़ करवाये हे ।
281474976724373	उ चाय बनावति अहय ।
281474976724375	राधा नाची गाई अउर मेहमानन कय मनोरज़न कराई ।
281474976724376	हम लडकी कॊ झाडु से कमरा साफ़ करवाइन ।
281474976724377	राधा गाँव मा कही नही गईं ।
281474976724378	कृपा कयके जाय ।
281474976724379	भूख से हमार आँती कुकुआती अहय ।
281474976720033	का ई सही रहे तोहरे बरे ।
281474976719851	हम बाजार जात अही ।
281474976719853	तू बस सख़्या पैंसठ लय सका थ्या कस्बा जाय के बरे ।
281474976719854	कल वे नगर गये ।
281474976719855	अगर तू पढाई ना करब्या तव फ़ेल होय जाब्या ।
281474976719857	वे शायद ही कल अइहै ।
281474976719859	वे शादी के बरे एक लडकी देखे ।
281474976719861	हम उनका कल किताब देबय ।
281474976719863	आह सुम्मार आय ।
281474976719864	कुर्सी लरकय तोडे अहय ।
281474976720078	हमका लागा थय वे ना अइहैं ।
281474976720079	लरिका सोय चुका हय ।
281474976720082	वे दुय दिन पहिले बाक्स खोले रहे ।
281474976719987	रुबी राधा से लम्बा हय ।
281474976719989	कौनव लरिका नही आयें ।
281474976719991	थोडा चाय वाय लिया ।
281474976719992	हमार बहिन भी हमाय विश्वास नही किहिस ।
281474976719994	हम चलै नही पावत अही ।
281474976720142	कल वे सब चोर का पकड लेहे रहे ।
281474976720143	हम दुइ जने एक दूसरे से मिले ।
281474976720144	कुत्ता बच्चे का रुलाय दिहिस ।
281474976720146	वे कल नगर गा रहे ।
281474976720147	जा अव देखा ।
281474976720148	हम रविवार का कलकत्ता जाबय ।
281474976720149	हम उनसे कांच तोडवाइन ।
281474976719867	हम ई नही कहिन कि ऊ खराब नाही अहय ।
281474976719879	हर आदमी का दस रुपया दिया ।
281474976719890	महतव राधा से लम्बा हय ।
281474976719919	हम आज रात शहर जावाइयाँ अही ।
281474976719986	टीटू खाना बनावत अहय ।
281474976719995	तू उनका किताब दियत अहा ।
281474976719921	हम अबे ताई नही खाये अही ।
281474976719922	हमरे सिरदर्द अहय ।
281474976719924	वे एक मनई का देखीं ।
281474976719926	का तू अबही आय सका थ्या ।
281474976719927	पिताजी अपने लरिकन के बरे खेलाउना खरीदें ।
281474976719929	वे कलकत्ता से अइहै ।
281474976720034	हमाए बहिन विद्यालय मा हय ।
281474976720036	भारत मा सबसे लम्बी नदी गग़ा हय ।
