ID	Transcription
281474976716243	वे हमका फ़ोन करें ।
281474976716309	तू वोहका रोज किताब दिया थ्या ।
281474976716310	हम सिर्फ़ चावल खाई थे ।
281474976716311	हियाँ धुम्रपान करब मना अहय ।
281474976716312	हम खुद का पसन्द करी थे वे खुद का पसन्द करा थीं ।
281474976716313	वे धडाम से गिर गयें ।
281474976716314	हम आज रात कई शहर जाय चाहत अही ।
281474976716315	उन लोगन का रस्सी से बाँध दिया ।
281474976716316	हम कबो शराब नाही लीत ।
281474976716318	हमका ब आराम ना करय दिया ।
281474976716219	दरवाजा कय सिकडी टूट बा ।
281474976716220	वे आयेन बैठेन खायेन अउर चला गयेन ।
281474976716221	का तू वोहका देखे अहा नाही ।
281474976716222	तू वोहका किताब देत अहा ।
281474976716223	हमरे समूह मा तू सबसे अच्छा इन्सान अहा ।
281474976716445	हम गिर गये जब एक कार हमका टक्कर मारिस ।
281474976716446	का तू आपन काम नाही करया ।
281474976716447	हम अब उनसे नाही मिलित ।
281474976716448	हमरे दोस्त कय बहिन बिमारि अहय ।
281474976716449	वे सब रोजय बाजार जा थें ।
281474976716451	हमका पता नाही अहय ।
281474976716452	हम खुद का शीशा मा देखिन ।
281474976716381	कोनव भी बच्चा नाही आयें ।
281474976716382	वे स्कूल जाय काहे छोड देहें ।
281474976716383	तू अब ना जा ।
281474976716384	भारत मा सबसे लम्बी नदी गंगा अहय ।
281474976716387	वे छत पय भाग गईं ।
281474976716388	ना हम ना तू यह परेशानी का हल कय सकी थे ।
281474976716389	मेज पय दस किताब अहयं ।
281474976716462	तोहाय नाम काव अहय ।
281474976716516	टीटू खाना बनावत रहें ।
281474976716364	तोहार घर कहाँ अहय ।
281474976716365	वे रोज बाजार जा थें ।
281474976716366	भूख से हमार अंतरी कुरकुरात अहय ।
281474976716367	वे घूंट-घूंट पानी पी गयें ।
281474976716368	ऊ घर बडा अहय ।
281474976716370	प्रवेश ना करें ।
281474976716371	तोहका केतना गाय चाही ।
281474976716463	सीता अउर राजा का लाग की वे एक दूसरे से लडत अहयं ।
281474976716464	हम जात रहे ।
281474976716465	आज सोम्मार आय ।
281474976716466	आया बच्चा का खाना खावाईं ।
281474976716467	सब लदकियन मा वे सब्से सुन्दरी अहय ।
281474976716468	चिडिया पेडे पय नाही अहयं ।
281474976716469	कुत्तय भौंकत अहयं ।
281474976716470	वे खाना खाय लेहे अहयं ।
281474976716255	तू रोज चावल खा थ्या ।
281474976716257	खाई के बाद सोया ।
281474976716259	कुत्तवय बच्चन का रोवाय देहें ।
281474976716260	तू वोहका बच्चा देत अहा ।
281474976716261	राधा का केतना पैसा मिला ।
281474976716262	हम अबे तक नाही खाये रहे ।
281474976716708	कानून आदेश दियय की शराब का मन्दिर,मस्जिद चर्च के पास ना पियय का चाही ।
281474976716531	वह बहुत ही मधुरमय गाती है ।
281474976716532	राधा धीरे चावल खाई ।
281474976716533	तुम रोज स्कूल जाते हॊ ।
281474976716534	प्रवेश ना करे ।
281474976716535	मै रात को चावल खाँउगा ।
281474976716536	तुम उसे रोज बच्चा दो ।
281474976716537	कुत्ते ने बच्चे को रुला दिया ।
281474976716538	यदि अच्छी वर्षा होगी तो अच्छी खेती होगी ।
281474976716539	तुम रात मे चावल खाओगे ।
281474976716540	टीटो ने राधा को सुलाया ।
281474976716541	वह कलकत्ता से आयेगी ।
281474976716542	छत से हर-हर पानी गिर रहा है ।
281474976716543	सारी लडकियाँ कक्षा मे आयी हैं ।
281474976716544	मुझे थोडा चाकलेट दो ।
281474976716689	कुत्ता भौकत अहयं ।
281474976716690	हम का पता नही ना ।
281474976716691	ऊ अबही मैदान जात अहय ।
281474976716692	वोहकय नाम कृष्णा अहय ।
281474976716693	ऊ घर मा अहय ।
281474976716694	तू अब हिलय का ना चाही ।
281474976716695	तू काल शहर गा रह्या ।
281474976716698	आस-पास अउर दूर-दराज कय सब लोग सभा मा पहुँचा रहें ।
281474976716825	इ गाढा लाल अहय ।
281474976716828	दरवाजा खोला ।
281474976716830	वे पत्थर तोड देहे ।
281474976716831	सूबेरेन चावल बनाइन ।
281474976716833	तेजी से भागिन ।
281474976716618	सूरज पूरबय मा उगा थय ।
281474976716619	हमरे परिवार मा मुर्गा अउर मुरगी अहय ।
281474976716620	हम सिरिफ़ चावलय खाई थे ।
281474976716621	तू खुदय से चावल बनाया ।
281474976716623	तू अबे चावलय खात अहा ।
281474976716625	दरवाजा अपने आपय खुल गवा ।
281474976716626	वे धडाम से गिर गये ।
281474976716627	कईव बार वोहका भूत देखान ।
281474976716557	पेड पर बन्दर अहय ।
281474976716617	केहू का हियाँ अंग्रेजी आवा थय ।
281474976716638	तोहार घर कौन आय ।
281474976716652	तू वोहका किताब दियत अहा ।
281474976716762	मेज पय दस किताब अहय ।
281474976716763	अब वोहसे नाही मिली थय ।
281474976716764	वे स्कूल जाब काहे छोड देहें ।
281474976716765	हमरे समूह मा तु सबसे अच्छा इंसान अहा ।
281474976716766	काल स्कूल ना आउबय ।
281474976716767	उ आपन काम नाही खतम कीहीं ।
281474976716768	वे अग़्रेजी बोला थीं ।
281474976716769	जा अउर कुछ पाथर लैके आवा ।
281474976716770	वे सोवत रहे हें ।
281474976716771	हमाय बहिन विद्यालय मा अहय ।
281474976716772	हमसे बिना पूछे अन्दर ना आया ।
281474976716773	ऊ आइस बैठिस खाइस अउर चला गा ।
281474976716774	उ काल्ह नगर गवा ।
281474976716573	चिडिया पेड पय नही ना ।
281474976716574	के का केतना पैसा मिला ।
281474976716575	हम काल तुहका बच्चा देबय ।
281474976716576	राधा सीता से बोली की राखी खुदय का पसन्द करा थीं ।
281474976716577	कृपा कयके दरवाजवा खोल दिया ।
281474976716578	हम ऐतुवार का कलकत्ता जाबय ।
281474976716579	सब जने पास नही भये ।
281474976716580	उ तव कल कुछहु नही खाइस ।
281474976716581	हम अउर हमार भाय साथय मा खेला थय ।
281474976716583	टीटो के अम्मा टीटोवय से राधा को सोवावा थीं ।
281474976716653	वे घर मा होइहैं ।
281474976716654	उन सबका रस्सी से बांध दिया ।
281474976716658	वे एक मस्ट्राइन रहीं ।
281474976716659	कुर्सी लडकवय तोडे ।
281474976716660	राजा आपन घर काल्ह छोड देहें ।
281474976716866	काल्ह यह समय तक ऊ कलकत्ता पहुंच गय रही ।
281474976716870	उ उछल-उछल के अपने घर पहुँच गवा ।
281474976716871	ऊ वोहका किताब दियत रहन ।
281474976716872	वोहका काल्ह बच्चा देबय ।
281474976716873	वे बिना केहू का बतायेन चला गयें ।
281474976716875	राधा गाँव मा कतहूं नाही अहयं ।
281474976716876	ऊ अपने बहिन से जादय सुन्दरी अहय ।
281474976716877	ऊ शिक्षक नाही अहय ।
281474976716879	रूबी राधा से लम्बा अहय ।
281474976716880	काल्ह दस बजे सबेरे ऊ हियाँ रहे ।
281474976716736	उ वोहका किताब दे ।
281474976716737	तू हमका नही जाना तहा ।
281474976716738	हमार बहिन ही हमार विश्वास नही किहीं ।
281474976716740	घर मा बहुत सारे पेड अहयं ।
281474976716741	बारिश हुअति अहय ।
281474976716743	नही खाये अही ।
281474976716744	नाही खाये रहे ।
281474976716746	कोनव बच्चा नाही आवा ।
281474976716791	छात्र का छडी से ना पीटय ।
281474976716792	ऊ सोवत अहय ।
281474976716793	ऊ पानी पी गवा ।
281474976716794	कृपा करके जा ।
281474976716795	जंगल मा अहयं ।
281474976716797	राधा रमेश के साथे शहर गय ।
281474976716798	टेबल पय दुय किताब अहय ।
281474976716558	सब जने का दस रुपया दय दिया ।
281474976716559	हम दुइनौ जने एक दुसरे से मिली थे ।
281474976716560	सब घरे मा एक कुत्ता अहय ।
281474976716561	हमका खाना खाय का अहै ।
281474976716562	वह शायद कलिहैं आवा ।
281474976716563	ऊ अबे घरय पय होई ।
281474976716564	ऊ तीन सुवर घर के पिछवा रक्खा थय ।
281474976716565	राधा अपने लिए एक साडी खरीदीं ।
281474976716567	हम वोहसे काँच तोडवाइन ।
281474976716570	उ घर मा रहा ।
281474976716571	ना हम ना तू यह परेशानी का हल कय सकत रहिन ।
281474976716572	उ वोहका एक बच्चा दियत अहय ।
281474976716671	कल सबेरे वे जंगल जात रही ।
281474976716675	वे काल नगर गा रहें ।
281474976716676	सभी लडकियन मा ऊ सबसे सुन्दर अहय ।
281474976716677	ऊ धीरे चला थय ।
281474976716678	हम ई नाही कहिन की ऊ खराब नही ना अहय ।
281474976716679	वे काल्ह कलकत्ता जाई ।
281474976716598	आया से बच्चा का खाना खेलाई ।
281474976716600	हियाँ धूम्रपान करब मना अहय ।
281474976716601	हम सबका बिजली के तार कय जरुरत अहय ।
281474976716603	वे राधय अही जौन खइहैं ।
281474976716605	वे सब हमका अपने बारे मा बताये ं ।
281474976716709	वे दुपहर मा गइहैं ।
281474976716710	हम बस से आउबय ।
281474976716711	मजदूर का घर बनावय के बरे पचास पत्थर कय जरुरति अहय ।
281474976716712	वे गेँद का मारें ।
281474976716713	तु वोहका किताब दियत अहा ।
281474976716715	बच्चा जलदी जलदी चलत रहन है ।
281474976716716	हम सिरफ़ चावलय खायी थे ।
281474976716717	हम अब बजार जात अही ।
281474976716718	कल वे रात मा चावल खाइहैं ।
281474976716719	दरवाजा कय सिकडी टूटी अहय ।
281474976716720	शायद उ काल्ह सुबेरे जलदी आवय ।
281474976716722	काल उनहिन चोर का पकड लेहे रहें ।
281474976716723	तोहार नाम का अहय ।
281474976716724	हम वोहका एक किताब दियत अही ।
281474976716641	राधा वोतनिन अच्छी अहयं जेतनी रूबी ।
281474976716642	वे बाजार गा है ।
281474976716643	वे दिल्ल्ली जइहैं ।
281474976716644	ऊ तव छत पय भाग गय ।
281474976716645	राधा वोतनी अच्छी अहय जेतनी की रूबी ।
281474976716646	सब जने परीक्षा पास नही भयें ।
281474976716647	उनका एक बच्चा दियत अही ।
281474976716648	नीचवा देहे उदाहरण कय प्रारुप बतावा ।
281474976716649	वे वोहका किताब दियत अहय ।
281474976716651	वे मस्टराइन भईं ।
281474976716852	तुहका ऐसे ना बतावय का चाही ।
281474976716854	उनका जाय दिया अउर चाय पिया ।
281474976716858	अम्मा आया से बच्चा का खाना खावावाई ।
281474976716859	कुछ लडकय कक्षा मा नाही आयें ।
281474976716860	वे हमरे सम्प्रदाय कय मुखिया अहें ।
281474976716861	फ़ूल सुन्दर अहय है ना ।
281474976716862	राधा हमका पैर से मारी अव भाग गईं ।
281474976716864	वे लोग हमसे प्यार करती हैं ।
281474976716865	तू कब जाबा ।
281474976716882	के खुदय कय प्रशंसा करा थय जे खुदय कय प्रशंसा करा थय ।
281474976716883	हमरे पास पैसा ना होत तौ हम चल सकत रहिन ।
281474976716884	ऊ सिरफ़ अपने परिवारय के खातिर काम करती अहय ।
281474976716885	भगवान तोहाय भला करय ।
281474976716887	ऊ सच नही बोलत अहय है ना ।
281474976716888	हम वोहका काल्ह किताब देबय ।
281474976716889	राधा नाची गायी अउर मेहमानन कय मनोरंजन किहीं ।
281474976716777	हमका नाही लागत की ऊ आये ।
281474976716778	चाय बनावति अहय्.न ।
281474976716779	हम वोहका घर से बाहर लै जावा चाहत अही सोमवार का ।
281474976716780	सीता अउर राजा का लाग की वे एक दूसरे से लडत रहे हें ।
281474976716781	टैंक मा पानी नाही अहय ।
281474976716782	हम मैदान जात अही ।
281474976716783	तू काल कलकत्ता जाबा ।
281474976716784	गांव कय ई सबसे पुरान पेड अहय ।
281474976716785	तनिक देर पहिलेन चावल खायें ।
281474976716786	हम लडकिया का काम करय वाली से कमरा साफ़ करावय का बोला है ।
281474976716787	संख्या,लिग़,अउर सम्मानसुचक कय जाँच करा ।
281474976716789	वे स्कूल जात अहयं ।
281474976716748	रुबी सबय से तेज दौडा थय ।
281474976716749	उनका लागा थय की ऊ ना आये ।
281474976716751	आज रातय का शहर जावा चाहत अही ।
281474976716752	हमरे सर मा दर्द हुअत अहय ।
281474976716753	राधा अबहिन अबहिन घर का छोड दिहिन ।
281474976716754	तू वोहका बच्चा दियत अहा ।
281474976716755	तू कबो शराब नाही लेइत ।
281474976716757	हम कतहू भी जाय सकी थे ।
281474976716758	हम गिर गइन जब हमका एक कार टक्कर मारी से ।
281474976716759	हमका चावल वावल दय दिया ।
281474976716760	दूसरे कय अनुकरण करा थी ।
281474976716761	तू आपन काम नही केहे अहा ।
281474976716810	नही जाय सकत ।
281474976716812	पिछलेन सप्ताह वे दिल्ली जाय चुका हय ।
281474976716814	किसान कुदार-उदार लैके खेत मा जा थीं ।
281474976716815	तू हमरे साथ अउबा ह ना ।
281474976716817	खराब मौसम के वजह से हम लोग गाँव नाही जाय पाइन ।
281474976716819	उनका जाय दिया ।
281474976716820	हम काल्ह दार्जिलिग जाबय ।
281474976716821	वे पंचय अपने -अपने गाँव चला गयें ।
281474976716822	का तू काल्ह हियाँ आय सका थ्या ।
281474976716823	हम हियाँ तुहका देखय आवा अही ।
281474976716545	डकैतों ने घर को जला दिया ।
281474976716546	राजीव टोटो सब्से लम्बा है ।
281474976716547	खुल के बोली तौ हमका चाय नही ना पसन्द अहय ।
281474976716548	महतो तैरय चला गा है ।
281474976716549	अगर वह कल आवा होत अतव हम मनाय सकत रहिन ।
281474976716550	वे बोलति अहयं कि औरत जमीन पय सोवत रही ।
281474976716553	लोग हियाँ एकट्टा अहयं ।
281474976716555	वे घर मा रहे ।
281474976716843	तू बस संख्या पैंसठ लय सका थ्या कस्बा जाय के खातिर ।
281474976716846	ऊ कपडा धुलत रही ।
281474976716847	भुख से हमार अंतरी कुरकुरात अहय ।
281474976716848	खाना खाये के बाद वे सोवय चला गये ।
281474976716851	हमका भूख नाही अहय ।
281474976716588	हमरे पास पैसा नही ना ।
281474976716589	वे दुइ दिन पहिलेन बाक्स खोलेन रहे ।
281474976716590	वे काल्ह कलकत्ता जइहैं ।
281474976716592	हम हुआ नही जाय सकत रहिन ।
281474976716593	तू सबे रे चावल खाये रह्या ।
281474976716594	केहू खुदय कय तारीफ़ नही करा थय ।
281474976716595	पतिवय पेडवा से नीचेन गिरती अहय ।
281474976716725	सबेरेन चावल खाये रही ने ।
281474976716726	दिल्ली अकेलेन जाय सकत है ।
281474976716728	हमरे आस-पडोस मा सबै बहुत अच्छा है ।
281474976716730	छॊटय केला देहा ।
281474976716731	उ फ़ुटबाल रोजय खेला थय ।
281474976716732	उ हियाँ नही ना अहय ।
281474976716733	हम नाही खाये होबय ।
281474976716734	राधय के कारण से ऊ मर गवा ।
281474976716699	सूरज पूरब मा उगा थय ।
281474976716700	के के जंगल मा जाये ।
281474976716701	राधा अउर राजा एक दुसरे का देखें ।
281474976716702	का तू वोहका देखा हा नाही ।
281474976716705	का तू अबही आय सकत अहा ।
281474976716629	मधू अपने लडकवन से बहुतय प्यार करा थीं ।
281474976716631	वे अबहीं मैदान जात अहयं ।
281474976716633	ऊ हंसतय-हंसतय पागल होई गा ।
281474976716635	वे काल कलकत्ता जइहैं ।
281474976716636	का हम तुहका काल्ह बोलाय सकी थे ।
281474976716607	वे रोजय स्कूल जा थीं ।
281474976716608	घर बडा के अहय ।
281474976716609	हियाँ बोटा अहय ।
281474976716611	वे रोजय बजार जा थीं ।
281474976716612	बारिश हुअत रही यही बरे हम खेत मा नही जाय पाइन ।
281474976716614	हियाँ हुँआ किताबय गिरी अहयं ।
281474976716615	वे एक आदमी का देखें ।
281474976716662	रोज चावल खाई थय ।
281474976716663	वे घर से बाहर गय अहय ।
281474976716664	वे उनका एक बच्चा दियत अहयं ।
281474976716665	हमरे खोपडी मा दरद अहय ।
281474976716667	तू काल्ह वोहका किताब दय देहा ।
281474976716668	वे वोहका एक बच्चा देत रहें ।
281474976716669	हम जानत अही की काल्ह छुट्टी अहय ।
281474976716670	पिताजी अपने लडकवन के खातिर खेलाउना खरींदे ।
281474976716681	वे अबही बाँस काटत अहय ।
281474976716682	हमरे दादी अम्मा हमका बहुत सारा बिस्कुट दिहीं ।
281474976716683	तू कुल्हरी से पेड का काटेन अहयं ।
281474976716684	घरे-घरे जाय के हम जलावन एकट्टा किहिन ।
281474976716685	हम अबे तक नाही खाये रहिन ।
281474976716834	तू काल्ह तक आपन काम समाप्त कय देहे रही ।
