ID	Transcription
281474976723215	ई लंबा पेड़ बा ।
281474976717233	कलकत्ता में देश क सबसे अच्छा मीठाई मिलेला ।
281474976718068	हमार बहिन स्कूले हऽ ।
281474976723424	हमार बहिनियो हमार विश्वास ना कईलीं ।
281474976718941	हम चल नाहि पावत हई ।
281474976719080	तू अभहीं भात खात हउअ ।
281474976718204	लोग इहां इक्ठा भेलु्अन ।
281474976716977	ऊ एगो आदमी के देखलस ।
281474976719023	लोग इहां जुट गइलन ।
281474976726456	ऊ स्कूले गईल कांहे छोड़ दिहले ।
281474976718368	उ घरे से बाहर गइल हे ।
281474976717260	हम ओकरा के किताब दे तनी ।
281474976717513	तू काल कलकत्ता जइबे ।
281474976718220	ई लम्हर पेड़ हऽ ।
281474976723435	ऊ स्कूले जा तरन ।
281474976718053	कुक्कुर भोकत हुअन सन ।
281474976717189	तोहके अब हीले के ना चांही ।
281474976717408	शायद आज मंत्री जी ना अइहन ।
281474976717347	राधा अभिये घर छोर देलस ।
281474976716956	ऊ सूतत रहल ह ।
281474976726444	हम एगो मेला में जा तऽनी ।
281474976726426	हमरा आम नीमन लागेला ।
281474976723456	हमरी आस पड़ोस में सब बहुत अच्छा हऊअन ।
281474976723212	के अपन बड़ाई करेला ।
281474976717307	उ सुत गइल रहे ।
281474976718181	तू कल ओके किताब देदे बऽ ।
281474976719095	कल उन्हाने चोर पकल लेले रहलन ।
281474976717072	हमनी क अब बजारे जा तनी जा ।
281474976716959	ऊ दिल्ली जाई ।
281474976725027	टूबर में बारिश भईल रहे ।
281474976717545	उ ओकरा एगो बच्चा देवेला ।
281474976717236	हम काल ना खईले रहनी ।
281474976717372	पिछला बरिस अक्टूबर मे बूनी भइल रहे ।
281474976726353	का जाने बढ़िया बारिश होई त बढ़िया खेती होई ।
281474976719125	हम सवेरे भात खइले रहे ।
281474976723274	ऊ लोगन अपने बारे में हमके बतौलन ।
281474976725863	इ तोहरा ला सहि रहि ।
281474976726312	हम राती खाना भात खाईब ।
281474976726026	घूसऽ मत ।
281474976717478	हम ओकर भाई के देखनी ।
281474976726489	ऊ दू दिन पहीले बक्सा खोलले रहलन ।
281474976726286	ऊ देखलन की मय लोग पत्थर से खेलऽ ता ।
281474976723499	हमके ई काम करेदऽ ।
281474976717213	हमके जएदऽ और चाय पीयऽ ।
281474976726132	बारिश होता ।
281474976723266	तू काल एईजा आ सकेलऽ ।
281474976718016	का तू अब्बे आसकत हुआ ।
281474976718172	तू बजार जात हवा ।
281474976718821	हम ओके एखे किताब देत हई ।
281474976726028	उ काल कलकत्ता जा रहल बाड़ी ।
281474976723416	हमनी के पत्थर से घर बनौले बानी ।
281474976717535	उ अंग्रेजी बोलेलन ।
281474976725981	हमर भूख लागल बाटे ।
281474976725839	का तू अभी आसकेलऽ ।
281474976726348	ऊ फुटबॉल रोज-रोज खेलेलन ।
281474976717468	उ पथ्थर तोड़ देलस ।
281474976719107	उ एके आदमी देखलेस ।
281474976718991	उ काल शहर आयल रहल ।
281474976726235	कुर्सी लईकन के तुरल हऽ ।
281474976719053	हम ओकर कपार खच से काट देली ।
281474976718337	कल दस बजे सवेरे उ ईहां होई ।
281474976723422	हमसे बिना पूछले घुसल मत करिहऽ ।
281474976723458	ऊ दिल्ली जाईहन ।
281474976719093	तू ओके किताब देत हयऽ ।
281474976718934	उ अभहीं पढ़ऽ जात हौ ।
281474976723378	हमरे दोस्त के बहिन बेमार बाड़ी ।
281474976717399	टिटो राधा के सुतइलस ।
281474976718938	राधा के कारन उ मर गेयल ।
281474976723370	हमार बहीन स्कूले में बाड़ी ।
281474976723315	ऊ रोज स्कूले जा तरन ।
281474976717164	हमार आस पड़ोस में सब बहुत अच्छा बा ।
281474976717167	ऊ अब मैदान जा ता ।
281474976723206	हम ओके एगो लइका देत हईं ।
281474976725781	उ लोग अंग्रेजी बोलेला लोग ।
281474976716978	काल सबेरे ऊ जंगल जात होई ।
281474976726468	हम गिर गईनी जब एगो कार हमके धक्का मरलस ।
281474976717420	हमरा के चावल वावल दऽ ।
281474976725887	आपन खाना खइला के बाद उ सूते चल गइल ।
281474976718122	इहवां बोटा हऽ ।
281474976718903	उ घरे मे रहल ।
281474976717378	आया बच्चा के खाना खिलऽइली ।
281474976725038	बार-बार उनके भूत लऊके ।
281474976717589	हमनि के बिजली के तार के जरुरत बा ।
281474976726118	केहु आपन बड़ाई ना करेला ।
281474976717188	ऊ फुटबाल हर दिन खेलेला ।
281474976717308	उ रोजे बजारे जायलन ।
281474976718855	खराब मौसम के वजह से हमनी के अपने गांव नही जा पइली ।
281474976718072	हम चावल और सबजी खात हई ।
281474976719001	कलकत्ता मे देसे के सबसे बढ़िया मिठाई मिलेला ।
281474976719116	हर घरे मे एकखे कुक्कुर हऽ ।
281474976717398	हम हर दिन चलत चलत थक गइल बानि ।
281474976726192	हम तोहके ना जानी ले ।
281474976718310	कलकत्ता मे देस का सबसे अच्छा मिठाई मिलेला ।
281474976719002	उ पुरा बच्चन के रुलादेलस ।
281474976723312	ऊ कमरा के साफ कईलन ।
281474976726178	ऊ कल कलकात्ता जा तऽरन ।
281474976718357	उ लोग आपन काम नाहि खतम कइनऽ ।
281474976717610	जो और पाकल हुअल तनि फल ले आओ ।
281474976719028	ओन्हाने एक दुसरे का नकल करलन ।
281474976719134	तू काल सहर हइल रहलऽ ।
281474976725757	उ भात खाई ।
281474976718872	कल राती मे उ भात खाइ ।
281474976718045	उ सुत्त हऽ ।
281474976725808	हमर कपार मे दरद होता ।
281474976718055	तहार नाम का हऽ ।
281474976723497	तोहके केतना गाय चांहि ।
281474976718050	रधा मोजोरम रहेले ।
281474976717543	उ मर गइल ।
281474976718143	पेड़ पर बंदर हऽ ।
281474976717297	तू ओकरा रोजे किताब देवेलस ।
281474976717021	ऊ घर में रहे ।
281474976723532	ऊ गा ना सकेलन ।
281474976725957	उ अभिन बिद्यालय जातरि ।
281474976723433	ऊ ओके किताब दे तरन ।
281474976718889	हम नइया से अइलि हऽ ।
281474976723187	ऊ दूध ऊध खरीदीहन ।
281474976717409	तू कब जइबे ।
281474976726108	मजदूर के घर बनावेला पचास गो पथ्थर के जरूरत बाटे ।
281474976717485	हमरा जाय दऽ ।
281474976717050	ऊ ओकरा के किताब देला ।
281474976716908	काल ऊ कुल चोर के पकड़ लीहनऽ सऽ ।
281474976719121	उ काल कुछो ना खइलेस ।
281474976726204	ऊहां लोग अपनी-अपनी गांवे गईलन जा ।
281474976726073	हमनी के दुनो एक दुसरा से मिलनि सन ।
281474976723341	टीटू खाना बनावत रहलंऽ हऽ ।
281474976717575	डकैइत सब घर के जला देलऽ सन ।
281474976718266	हम ओके कल बच्चा देब ।
281474976725777	उ सूत गइल रहे ।
281474976726040	उ लोग एक दुसरा के देख के काम करेला लोग ।
281474976717617	उ अब बांस काटत बाड़न ।
281474976718329	नद्दी मे पानी नहि हऽ ।
281474976725965	उ कोठरी के साफ कइलस ।
281474976723524	अगर बरखा होई त हम मुर्गा बनाईब ।
281474976717150	हमरा परिवार की लगे मुर्गा और मुर्गी बा ।
281474976716965	तोहरा के केतना गाय चांही ।
281474976718128	सीता अउर राजा के लगल कि उ एक दुसरे से लड़त हूंअऽ ।
281474976718026	हम अउर हमर भाई साथ मे खेलल जाई ।
281474976726363	काल्हु ई बेरा ले ऊ कलकत्ता पहुंच गईल होईहे ।
281474976725823	हम खइले ना होखेम ।
281474976725062	हमसे बीना पूछले परवेस मत करिहऽ ।
281474976726019	इ गाढा़ लाल बाटे ।
281474976726206	आजू बुझाता कि मंत्री जी ना अईहन ।
281474976718905	उ चाह बनावत हऽ ।
281474976718236	उ चावल खाइ ।
281474976723527	उ सुत गईल रहली ।
281474976718221	राधा सुत्त हइन ।
281474976717551	उ लोग आपन काम नइखे खतम कइले ।
281474976723286	ऊ धीरे चलेलन ।
281474976717429	राजा आपन पत्नी के फूल देलन या देलस ।
281474976717313	तू राती के चावल खइबे ।
281474976718308	बच्चा स्कूल जा सकत हऽ ।
281474976717239	नीचे दीहल गईल उदाहरण क प्रारूप बतलावऽ ।
281474976717182	ऊ दूपहर में गाई ।
281474976723519	राधा के केतना पैसा मिलल ।
281474976722084	निचे देयल गइल उद्धारण के पारूप बतलावऽ जाऽ ।
281474976717386	हम लइकि से कमरा साफ करवइनी ।
281474976725106	रूबी सबसे तेज दौऊरे ली ।
281474976723226	ऊ घूट घूट के पानी पी गईल ।
281474976718879	आज पानी बरसी ।
281474976726387	रूबी राधा से बड़ बाड़ी ।
281474976726127	हम अपना के शीशा में देखनी ।
281474976717071	जईबऽ ।
281474976725787	जेने तेने कितबवन बिखरल पड़ल बड़ऽ सन ।
281474976718115	उ ओके एकठे बच्चा देत हऽ ।
281474976723306	कुछ लड़का कक्षा में नाहीं अईलन ।
281474976723211	केहु खुद के बड़ाई ना करेला ।
281474976726275	तनी चाह आह ली ।
281474976717161	टीटो राधा के सुतौलस ।
281474976717013	राजा अपनी पत्नी के फूल दीहलन ।
281474976726373	पिछला हफ्ता में ऊ दिल्ली गईल रहलन ।
281474976723438	ऊ लोगन अपन काम ना खत्म कईलन ।
281474976718253	राजा आपन घर कल छोड़नऽ ।
281474976725853	राजा आपन घर कल छोड़ देलस ।
281474976718065	जो और तनी पक्कल फल ले आऔ ।
281474976723504	काल सुबेरे ऊ जंगल में जात होई ।
281474976725767	उ घर मे बाटे ।
281474976718156	तू राती मे चावल खइबऽ ।
281474976718069	सब अदमिन के दस रूप्या दऽ ।
281474976726074	हमनि के कहियों जा सकऽ तनि सन ।
281474976726039	लइका सूत गइल बा ।
281474976718195	दरवाजा खोला ।
281474976725857	इ पटरा मोट बाटे ।
281474976725901	हमनि के अब एगो मेला मे जातनि सन ।
281474976726372	हम भात औरु तरकारी खा तनी ।
281474976717064	कृपया जा ।
281474976717353	उ लोग हमरा से प्यार करेलन या करेली ।
281474976717553	उ काल कलकत्ता जाई ।
281474976723521	ऊ सुतल रहलन ।
281474976717047	ऊ आईल बईठल खईलस और चल गईल ।
281474976718285	उ सिक्छक नाही हवन ।
281474976718807	राधौ उतना नइखऽ जेतना रूबिया ।
281474976717248	काल दस बजे सुबह ऊ एईजे होई ।
281474976725773	लोग इहां गोटियाईल बा ।
281474976726309	तू अबे भात खा तरऽ ।
281474976718043	लइका सुत चुकल हऽ ।
281474976725933	हम तोहरा के कल बुला सकऽ तनि ।
281474976719065	हमके जाय दऽ अउर चाय पियऽ ।
281474976726012	काल उ रात मे चावल खाई ।
281474976723453	तोहार घर कहां बा ।
281474976723529	टीटो के माई टीटो से राधा के सुतवौली ।
281474976723423	काल ए टाइम ले ऊ कलकत्ता पहुंच गईल होईहन ।
281474976718168	आया बच्चा के खाना खियनीन ।
281474976718850	केवाड़ी अपने आपऽ खुल गेल ।
281474976726269	ऊ कूद कूद के अपने घर पहुंच गईल बाड़न ।
281474976726361	ऊ हाथी मारे के चहलन ।
281474976723182	तू अब ना जा पईबऽ ।
281474976723417	हम सिर्फ चाऊर खाई लां ।
281474976718138	ओकर नाम क्रीश्ना हऽ ।
281474976717035	पीछला सप्ताह ऊ दिल्ली जा चुकल रहल ।
281474976725930	उ टांगी से गाछ के कटलस ।
281474976725759	पिता जी आपन बच्वन ला खिलौना खरिदलन ।
281474976723268	हम सुबेरे चाऊर खईले रहनी ।
281474976723311	का तु घरे जईबऽ ।
281474976726256	भारत में सबसे लमहर नदी गंगा हऽ ।
281474976726469	हम अब मैदान में जा तनी ।
281474976716963	ऊ कुलहाड़ी से पेड़ कटलस ।
281474976717565	उ चाय बनावतीया ।
281474976725040	ऊ काल गांव गईल रहनऽ ।
281474976722077	सीता और राजा के लगल की उ एक दुसरा से लड़ऽ तड़न ।
281474976718779	राधा सीता से बोल्ली के राखी अपना के पसंद करऽलिन ।
281474976726362	ऊ कुल्हाड़ी से फेंड़ के कटलन ।
281474976722096	छत पे हर हर पानी गिरत रहे ।
281474976717407	उ ओकरा किताब दिही ।
281474976726317	ऊहन लोग हमरा से दुलार करे ला लोग करे ली लोग ।
281474976717007	राधो ओतने अच्छा बीया जेतना की रूबी ।
281474976718917	हम खाइ के ना खाएब ।
281474976723477	ऊ लोग हमसे प्यार करेली ।
281474976726224	माई नौकरानी से लईका के खाना खीवौली ।
281474976717154	ऊ एईजा नईखे ।
281474976726000	राधा सुत्ततिया ।
281474976719075	उ रोज पढ़े जात रहल ।
281474976723299	राजू घर छोड़ दिहलन ।
281474976725971	हम खाना खतनि ।
281474976723248	मधु अपना लइका के बहुत प्यार करेली ।
281474976717235	हम ए बेरा रात के सहर जाईल चाहऽ तनी ।
281474976717461	राधा मिजोरम मे रहे ले ।
281474976717019	अगर तू पढ़ाई ना करबऽ त फेल हो जईबऽ ।
281474976716947	हमार घर में बहुत सारा पेड़ बा ।
281474976717054	तू रोज स्कूले जालऽ ।
281474976718978	हम उन्हां नहि जासकिला ।
281474976718846	अस पास और दुरी दराजि के सभी लोग सभा मे पहुचेला लन ।
281474976723320	रमेश दऊड़लन ।
281474976726024	हमरा नइखे लागत कि उ आई ।
281474976717467	फूल सुन्दर बा हऽ नऽ ।
281474976726097	हम बिद्यालय नहि जाइम ।
281474976717381	हमरा भूख लागल बा ।
281474976718982	पेड़े पर बंदर हऽ ।
281474976717253	तोहार घर कंहा बा ।
281474976725832	हमरा केहु ना देखलस ।
281474976718795	किरपा करके जा ।
281474976726198	हमरा परिवार में मुर्गा मुर्गी बा ।
281474976717142	तू ओकरा के रोज किताब देलऽ ।
281474976718921	रुबी राधा से लम्बी हयीं ।
281474976725895	लइका स्कूल जा रहल बा ।
281474976717382	केहू आपन तारीफ ना करेला ।
281474976726047	खाय के बाद सुतऽ ।
281474976717111	मां ने आया से बच्चे को खाना खिऔलस ।
281474976717550	हम नइखि खइले ।
281474976718755	हमरे लग्गे पइसा नाही हऽ ।
281474976723300	ऊ रोज बजारे जाली ।
281474976717183	कुल लईकी कलास में आईल बाड़ी स ।
281474976726418	राधा रमेश के संगे शहर गईली ।
281474976717070	हम अब मैदान जा तनी ।
281474976717472	तू बजारे जात बाड़े ।
281474976726103	हम नाहि तू ई परेसानी के निप्टारा कर सकेनि सन ।
281474976718336	राधा चावल धीरे खइनी ।
281474976725869	हम अपना के पसन्द करेनि उ अपना के पसन्द करेलि ।
281474976719021	हमने पथ्थरे से घर बनइले हई ।
281474976726392	ऊ उनके एगो लईका देत रहलऽ ।
281474976719003	हमरे पाला मे तू सबसे बढ़िया आदमी हयऽ ।
281474976726378	जईबे आगे ।
281474976725881	उ गा ना सकेला ।
281474976717426	हमनी के रोज उस्कूल जायली जा ।
281474976717421	उ उछल्त उछल्त आपन घरे पहुंच गईल ।
281474976717148	हमके एगो छोट केरा दऽ ।
281474976717582	राधा अपना खतिर एगो साड़ी खरिदलस ।
281474976718358	हमसे बिना पुछे प्रवेश मत करिहऽ ।
281474976726367	हम उनकर मूड़ी खच्च दे काट देहनी ।
281474976718927	तू ओके बच्चा देत हयऽ ।
281474976718836	हमार भाई धीरे धीरे खाना खाला ।
281474976726196	ऊ उनके किताब दे तरंऽ ।
281474976716927	हम नईखी खईले ।
281474976718781	हमे अब आराम मत करे दऽ ।
281474976718920	उ अभी मैदाने जात हऽ ।
281474976716983	लईका शांती से सूतल बा ।
281474976726239	ऊनहन लोग अपने बारे में हमके बतावल लोग ।
281474976719079	हम काल ओके बच्चा देब ।
281474976725114	ऊ अभी स्कूल जात बाड़ी ।
281474976725890	उ सूतता ।
281474976718334	उ कल कुछो नाही खइनी ।
281474976717578	उ साच नइखे बोलत हऽ नऽ ।
281474976719139	उ सूत गइल हऽ ।
281474976716993	ऊ पथर तूड़ दीहलस ।
281474976723476	हम एगो मेला में जा तनी ।
281474976725866	तू हमरा के नइखऽ जानत ।
281474976726337	अगल-बगल और दूरदराज के सभी लोग पंचायत में पहुंचल रहल लोग ।
281474976725970	नीचे जौन उद्धाहरन देले बा ओकर ढंग बतलावऽ ।
281474976723254	हम गिर गइली जब एगो कार हमके टक्कर मार दिहलस ।
281474976723475	हमके एगो छोट केरा द ।
281474976717130	ई गाढ़ा लाल है ।
281474976718809	उ हसत हसत पगला गइल ।
281474976716962	ऊ घर में बा ।
281474976726048	तू रात मे भात खइबऽ ।
281474976717162	तनी चाय वाय लऽ ।
281474976719037	राधा ओसे प्यार करऽलिन ।
281474976717329	तू खुदे चावल बनइ लऽ ।
281474976718813	उ मास्टर ना हयन ।
281474976726058	हमनि के सबेरे भात बनौनि सन ।
281474976717363	हम जानत बानी के काल छूट्टी बा ।
281474976722066	उ लोग चल देले होतन ।
281474976723396	ऊ बीना केहु के बतौले चल गईलन ।
281474976726101	हम तोहरा के परेशान नाहि करेम ।
281474976717487	उ नीचे गिर गइल ।
281474976723484	हम ओके एगो किताब दे तनी ।
281474976717177	ऊ शायदे काल आवे ।
281474976723228	केंवाड़ी के सीकड़ टूटल बा ।
281474976717129	ऊ हमरा के आशीर्वाद दिहलस ।
281474976726035	हमर यार के बहिन बिमार बिया ।
