ID	Transcription
281474976717232	का तू हमरा के नईखऽ जानत ।
281474976723531	हमरा घरे ढेर खाने पेड़ बा ।
281474976717048	सूरूज पूरब से ऊगे ला ।
281474976722089	उ घर से बाहर गइल बड़ी ।
281474976717492	उ दिल्ली जइहन ।
281474976725092	काल ऊ सबेरे जंगल जा रहल होईंहन ।
281474976725978	टीटो के माई टीटो के राधा से सुतवइली ।
281474976726140	ऊ बिना केहू के बतावल चल गईल ।
281474976719062	नोकरानी बच्चा के खाना खियऽइलिन ।
281474976725873	तू ओकरा के रोज किताब दे लऽ ।
281474976717320	पिता जी आपन बच्चा खतिन खिलौना खरिदलन ।
281474976718030	सायद उ कल सुवेरे जल्दि आवे ।
281474976717231	हारीस घर छोड़ दीहलस ।
281474976717314	आज सोमार बा ।
281474976717358	उ हमरा के फोन कइलस ।
281474976717375	उ सगाइ तोड़ देलस ।
281474976725972	हम रोजि ना मैदान जायनि ।
281474976718880	होसकऽता आज मंत्री जी ना आवंऽ ।
281474976717215	मधु अपना लईका से बहुत प्यार करेले ।
281474976726270	ऊ बीयाह करे खाती एगो लईकी के देखलन ।
281474976717237	ऊ उछल उछल के अपना घरे गईल ।
281474976717334	हम नाओ से आइल बानि ।
281474976718817	तू हमरे संगे आवत हउअऽ हऽ नऽ ।
281474976717187	हम और हमार भाई साथ में खेलब जा ।
281474976717592	उ घरे होई ।
281474976718112	तू बस संख्या पैसठ ले सकेला कसबा जाय बदे ।
281474976726183	ऊ घर से बाहर गईलन ।
281474976717104	का ई सही रही तोहरा खाती ।
281474976718244	रमेश दौड़लन ।
281474976718815	तू काल शहर गइल रहलऽ ।
281474976718366	पत्ती कुल पेड़ से नीदे गिरत हइन ।
281474976717170	ऊ ओकरा के एगो बच्चा दीहलस ।
281474976723351	तोहार का नाम ह ।
281474976717388	अगर उ काल आइल होइत त हमनी के त्योहार मना सकत रहीं जा ।
281474976717500	हमनि के तोहरा परेसान ना करल जाई ।
281474976717338	खराब मउसम के चलते हमनि के गांव ना जा पइनि जा ।
281474976725885	लगिचे अउरी दूर दराज के सब जगह के लोग सभा मे पहुंचल रहे ।
281474976718073	हम ओकर मुण्डी खच से काट देली ।
281474976716902	हमार बहीन हमार विस्वास ना कईलस ।
281474976717346	उ सिक्शक ना हऽ ।
281474976726364	हम गा सकेनी ।
281474976716971	राजा आपन घर काल छोड़लस ।
281474976719090	उन्हाने के रसरी से बांध दऽ ।
281474976726229	हमार कपार बथऽ ता ।
281474976719036	का तू हमके नाहि जानऽलऽ ।
281474976718275	उ ओके एकठे बच्चा देवेला ।
281474976718196	हम ओके घरे से बहरे ले जायल चाहत हइ सोमार के ।
281474976723296	अब हमके आराम मत करेदऽ ।
281474976717562	हमार बहिन बिद्यालय मे बिया ।
281474976716945	जंहा तांहा किताब बीखरल पड़ल बा ।
281474976718261	उ ओके किताब देहि ।
281474976716919	ओकरा के जाएदऽ ।
281474976726346	मेज पर 10 गो किताब बा ।
281474976718774	आज सोमार हऽ ।
281474976726351	हम रोज स्कूले जानी ।
281474976718993	हम ओके किताब देत हइ ।
281474976723514	उनकर नाव कृष्णा हऽ ।
281474976716931	तोहरा के अइसे ना बतावे के चांही ।
281474976726358	ऊ उनके एगो लईका देले बाड़न ।
281474976723414	हम नाव से आईल बानी ।
281474976723224	राजीव टोटो सबसे लमहर बाड़न ।
281474976717149	मजदूर के घर बनावे खाती पचास गो पत्थर क जरूअत बा ।
281474976723428	का तू अपन काम नईखऽ कईले ।
281474976717209	तू ओकरा के रोज बच्चा दऽ ।
281474976726032	टेबुल पर दस गो किताब बाटे ।
281474976718179	उ कल तक अपने काम समाप्त कर चुकल होई ।
281474976723462	हमके चाऊर वाऊर द ।
281474976717471	हम ओकरा घर से बाहर लेजाइल चाहतनि सोमार के ।
281474976723198	तऽनी चाय ओए पी लीं ।
281474976719015	उन्हन चल देले होतन ।
281474976723263	ऊ सच नईखन बोलत ह न ।
281474976716912	काल ऊ ए समय ले कलकत्ता पहुंच गईल होई ।
281474976717423	हम काल डार्जलिंग जाइम ।
281474976716904	हम काल स्कूले ना आईब ।
281474976723441	ई गाढ़ लाल बा ।
281474976717202	ऊ अब बांस काटऽ तनऽ स ।
281474976717198	तू भांड़ में जा ।
281474976717042	टेबल पर दूगो किताब बा ।
281474976719069	तू के अब हिलावे के ना चाही ।
281474976717171	एईजा धूम्रपान नईखे करे के ।
281474976723526	तू ओके रोज लईका दऽ ।
281474976718983	मेजी पर दू किताब हऽ ।
281474976717455	राधा गावं मे कहि नइखे ।
281474976718186	उ तीन ठे सूअर घरे के पीछे रखेला ।
281474976718892	पत्ती पेड़े से नीचे गिरत हऽ ।
281474976717369	बूनी होत रहे ए चलते हम खेत मे ना जासकनी ।
281474976726005	उ तीन सुअर घर के पिछुआ रखेला ।
281474976725849	उ ओकरा के किताब देला ।
281474976725874	उ घर मे रहे ।
281474976726246	ऊ दिल्ली जईहें ।
281474976726316	ऊ काल्हु शहर में गईल रहलंऽ हऽ ।
281474976725883	हम सवेरे भात खइले रहनि ।
281474976717222	तू काल कलकत्ता जईबऽ ।
281474976726200	हम जल्दी से भगनी ।
281474976718222	उ देखलस कि उ लोग पथ्थर से खेलत हुअन ।
281474976718974	कौनो लइकन ना अइलन ।
281474976718335	उ रोज बजार जाय नऽ ।
281474976725924	हमरा एक दर्जन केला देदऽ ।
281474976717344	हम खाली चावल खाईला ।
281474976725800	अब हमरा खाय के होखी ।
281474976717119	ऊ स्कूले जात रहलन सऽ ।
281474976717028	अगर ऊ काल आई त हमनी के त्योहार मना सकती जा ।
281474976718260	राधा अपने बदे एक साड़ी खरिदनि ।
281474976725049	कि रुबी रहली राधा ओतने सुंदर रहली जेतना कि रुबी ।
281474976725052	ऊ घुंट घुंट के पानी पी गईल ।
281474976723221	ऊ पत्थर तोड़ दीहलन ।
281474976723412	सुबेरे चावल खईले रहलऽ ।
281474976717351	किवाड़ खो ल ।
281474976723507	संख्या लिंग और सम्मान सूचक के जांच करऽ ।
281474976726186	सब लोग पास नईखे ।
281474976718882	उ ओके एक बच्चा देत हऽ ।
281474976726147	ऊ कल तक आपन काम खत्म कर चुकल होई ।
281474976726131	ऊ एक दूसरे क करता ।
281474976726428	राधा उतने नीमन बाड़ी कि जितना रुबी ।
281474976718796	हमरे पास पइसा ना होत तऽ हम चल सकत रहलि ।
281474976719007	राधा भात धीरे खइलिन ।
281474976718208	कुर्सी बच्चन के द्वारा तोड़न गयल हऽ ।
281474976717103	टैंक में पानी नईखे ।
281474976722086	हमनि के सुबह मे भात खइले रहीं ।
281474976718923	जा अउर कुछ पक्कल फल लेके आवा ।
281474976723383	तोहार घर कौन ह ।
281474976717343	हम अउर हमरे भाई साथे मे खेलल जाई ।
281474976718022	सब लोग पास नहि भइना ।
281474976726305	हमनी के पत्थर से घर बनौले बानी जा ।
281474976726291	राधा सूत गईली बाड़ी ।
281474976726137	तू दिल्ली अकेले चल जईबू ।
281474976723325	पिछला सलीया अक्टूबर में बारिश भईल रहल ।
281474976723377	ऊ दिल्ली जईहन ।
281474976717457	भारत मे सबसे लम्बा नदी गंगा हीयऽ ।
281474976717225	ऊ घूंट घूंट पानी पी गईल ।
281474976717264	ऊ लोग अपना अपना गांवे गईल ।
281474976725065	ऊ दू दिन पहीले बाक्स खोलले खोलले रहनऽ ।
281474976717544	उ दुपहरिया के गाई ।
281474976717184	हम जानऽ तनी की काल छुट्टी बा ।
281474976723309	हम ओकरी भाई के देखली ।
281474976725889	उ दू दिन पहिले डिब्बा खोलले रहे ।
281474976726479	तू उनके किताब दे तरऽ न ।
281474976718066	चिड़यी अब पेड़ पर नाही हे ।
281474976718952	उ एक मस्टराइन रहलिन ।
281474976725913	राधा अबगे घर छोड़ देहलस ।
281474976718367	कल उ राती मे चावल खाई ।
281474976725831	लागता आज मन्त्री जी ना अइहन ।
281474976725069	अगर ऊ काल आईल होतन त हम मना त्योहार सकती ।
281474976725934	काल सबेरे उ जंगल जाता ।
281474976722067	सब लड़कियन मे ऊ सबसे सुन्दर बाड़ी ।
281474976719063	उ घरे मे आइल रहल ।
281474976726090	बच्चा हाली हाली चलत रहे ।
281474976726014	तोहरा के केतना गाय चाहीं ।
281474976722082	राजीव टोटो सबसे लम्बा बाड़न ।
281474976717598	काल दस बजे सुबहे उ एहिजा होई ।
281474976723352	ऊ घर से बाहर गईल बाड़ी ।
281474976726332	टीटो राधा के सुता दिहलन ।
281474976717574	ना हम ना तू ई परेसानी के हल कर सकत बानि जा ।
281474976726262	ऊ एगो मास्टराईन रहली ।
281474976723214	हम रोज चलत चलत थाक गईल बानी ।
281474976717094	ऊ ओकरा के एगो बच्चा दे ता ।
281474976723193	घर घर जाके जलाव हम जलावन बिटोरले हईं ।
281474976717152	ऊ धड़ाम से गिर गईल ।
281474976717093	भाग जो ।
281474976718263	हमरे पास पइसा नाही हऽ ।
281474976718344	बार बार ओके भूत देखल ।
281474976717515	हम राती के चावल खाइम ।
281474976726179	हां हम घर जाईब ।
281474976717599	भगवान तोर भला करे ।
281474976725837	ऊ बिद्यालय जाता लोग ।
281474976723472	राधा सीता से बोलली कि राखी खुद के बहुत पसंद करेली ।
281474976725976	खुल के कहिं तऽ हमरा चाय पसंद नइखे ।
281474976718843	हम चाहिला कि उ रोज खेते जाय ।
281474976718969	हम गिर गइलि जब एक कार हमके धक्का मारलेस ।
281474976726293	हमार कपार बथता ।
281474976723319	मजदूर के घर बनावे खातिर 50 गो पत्थर के जरूअत बाटे ।
281474976717155	हमके नईखे लागत की ऊ आई ।
281474976717590	राधा अउर राजा एक दुसरा के देखलन ।
281474976717631	सबे लोग पास ना भइल ।
281474976717607	महतो राधा से लम्बा बा ।
281474976717003	ऊ ओकरा के एगो बच्चा देत रहे ।
281474976726360	केतना लईका क्लास में नईखऽ सऽ आईल ।
281474976718114	मधु अपने लइका से बहुत प्यार करेले ।
281474976718245	का तू आपन काम नाही कइले हउअ ।
281474976725926	हमरा लगे पइसा नइखे ।
281474976718191	टीटो कइसे गिरलन ।
281474976726025	उ कपड़ा धोऽत रहलि हऽ ।
281474976723408	ऊ चाय बनावऽ तरी ।
281474976726207	का उनको तू देखले बाड़ऽ ना ।
281474976718778	कल सवेरे उ जंगल जात होई ।
281474976718833	उ खाली अपने परिवार बदे काम करत हऽ ।
281474976723349	किसान कुदार उदार लेके खेते जालन ।
281474976717405	हमर दोस्त के बहिन बिमार बिया ।
281474976725945	टीटो राधा के सुतवलस ।
281474976726461	हम हम सही कंही त हमके चाय पसंद नईखे ।
281474976722073	दरवाजा के सिकड़ी टुटल बा ।
281474976718280	हम रोज चावल खाइला ।
281474976725053	कुर्सी लइकन के द्वारा तूरल गईल ।
281474976719046	तू रोज भात खाला ।
281474976718027	खराब मौसम के कारण अमन घरे नहि पहुंच पइलि जा ।
281474976717389	गावं के इ सबसे पुरान पेड़ हऽ ।
281474976723335	तू काल शहर गईल रहलऽ ।
281474976719092	पानी बरसत रहल एहि बदे हम खेते ना जा पइलि ।
281474976718805	तू ओके रोज किताब देलऽ ।
281474976717266	राधा रमेस की संगे सहर गईल ।
281474976726371	जा अऊरु कुछ पाकल फल ले आवऽ ।
281474976718324	प्रवेश न करा ।
281474976717325	तू रोजे चावल खायलस ।
281474976726390	तू राती खाने भात खईबऽ ।
281474976725840	राधा सीता के बोल्लस कि राखी अपना के पसंद करेलि ।
281474976718322	राधा अब्बे अब्बे घर छोर देहलिन ।
281474976718980	उ अभइ मैदाने जात हौ ।
281474976719120	हमके एक छोट केरा दऽ ।
281474976719098	उ दू दिन पहिले बक्सा खोल्ले रहल ।
281474976726357	राधा मीजोरम में रहेली ।
281474976725060	ऊ नीचे गिर गईलन ।
281474976718152	हम तेजी से भगली ।
281474976726138	ऊ एगो आदमी के देखलू ।
281474976726313	भूख के मारे हमार पेट कुलकुला ता ।
281474976723368	राधा अबे अबे घर छोड़ दिहनी ।
281474976723380	चिड़िया अब पेड़ पर नईखी ।
281474976726405	डाकू घर के जरा दिहलऽ सऽ ।
281474976717374	हमर आजी हमरा के बहुते बिस्कुट देली ।
281474976726037	नदि मे पानी नइखे ।
281474976718109	संख्या लिगं अउर सम्मान सुचक कऽ जाचं करऽ ।
281474976717263	हम एईजा तोहरा के देखे आईल रहनी हऽ ।
281474976717124	हम कंहीयो जा सकीना ।
281474976718320	उ आयल बइठल खइलस और चल गयल ।
281474976717613	उ केकरा के पसंद करेलस ।
281474976723482	हमरा परिवार की लगे मुर्गा और मुर्गी बाड़न ।
281474976726472	मजदूर के घर बनावे खाती 50 गो पत्थर के काम बा ।
281474976726075	हमर माई धीरे धीरे खाना बनावेली ।
281474976725892	तू बजार जा तरऽ ।
281474976725791	हम कबो सराब ना लेनि ।
281474976718205	इहवां बासं के रस्सी हऽ ।
281474976718095	हमरे आस पड़ोस मे सब बहुत अच्छा हुअन ।
281474976726447	ऊ उनके एगो बच्चा देतरन ।
281474976723249	हम आज रात के शहर जाईल चाहऽ तनी ।
281474976717362	उ रोजे बजारे जायले ।
281474976717614	नदी मे पानी नइखे ।
281474976726463	पिछले साल अक्टूबर में बूनि पड़ल रहल ।
281474976717076	तोहार नाम का ह ।
281474976717073	हमके जाएदऽ जा ।
281474976718788	उ अगर काल आयन होतन त हम त्योहार मना सकत रहलि ।
281474976717095	भारत क सबसे लंबी नदी गंगा ह ।
281474976717341	आस पास अउर दूर दराज के सबे लोग सभा खातिर पहुचल रहन ।
281474976718898	इ पेड़ लम्मा हऽ ।
281474976717340	उ कमरा के साफ कइलस ।
281474976725948	हम जानऽ तनि कि काल छुट्टि बाटे ।
281474976718823	भगवान तोहार भला करऽ ।
281474976717583	उ ओकरा किताब देत बा ।
281474976725780	राधा अपना ला एगो साड़ी खरिदली ।
281474976726043	उ लोग बजार गए रहे लोग ।
281474976726341	केंवाड़ी अपने से खुल गईल ।
281474976723411	गांव के ई सबसे पुरान पेड़ ह ।
281474976726015	बाग जा ।
281474976718028	उ अमन के स्मप्रदाय के मुखिया हऽ ।
281474976717443	कृप्या जा ।
281474976726208	कौनो लईका नईखऽ सऽ आईल ।
281474976725859	टिटो कईसे गिरल ।
281474976725774	उ ओकरा किताब दी ।
281474976723316	लईका के छड़ी से मत मारऽ ।
281474976718745	तोहार घर कवन हौ ।
281474976726089	उ दिल्ली अकेले जा सकेली ।
281474976717419	राधा के कितना पइसा मिलल ।
281474976725099	ऊ बहुते ही मधुरमय गावेली ।
281474976717348	उ देखलस के उलोग पत्थर से खेलत बाड़न ।
281474976726411	हमके जाएदऽ चाह पीयऽ ।
281474976723281	सूरुज पूरब में ऊगेला ।
281474976726455	ऊ रोजू बजारे जाले ।
281474976718058	हम खाना खात हई ।
281474976726301	उनका बेमारी खाती कुछु ना कईल जा सकेला ।
281474976725018	बाबूजी लईकन खातिर खेलौना खरीदलन हऽ ।
281474976718857	हम तेज से भग्ली ।
281474976726176	हम ऊनका से कांच तोड़वौनी ।
281474976719012	हर घरे मे एखे कुकुर हऽ ।
281474976726438	चाह के पीयल जाव ।
281474976717571	उ राधे बिया जे खाई ।
281474976717031	मैं घर में एगो कुत्ता बा ।
281474976716999	राधा चावल धीरे खईलस ।
281474976723517	पिछले हफ्तवा ऊ दिल्ली जा चुकल रहलन ।
281474976718362	हम अब मैदान जात हई ।
281474976717091	महतो तैरे चल गईल ।
281474976725118	टिटो की माई ने टिटो से राधा को सुलाया ।
281474976718141	तहार घर कवन हऽ ।
281474976718064	हम बस ले आइब ।
281474976726191	केहूके एईजा अंग्रेजी आवेला ।
281474976726334	ऊ उनके किताब दे तरन ।
281474976719031	हमके भूख लगल हऽ ।
281474976717524	उ हस्त हस्त पगला गइल ।
281474976725137	हम ओके एगो बच्चा देत बानी ।
281474976717411	राजू घर छोड़ देलस ।
281474976722075	मैंन आज रात को शहर जाना चाहता हूं ।
281474976723280	तू रोज स्कूल जालऽ ।
281474976717304	तू काल ओकरा किताब देदेबे ।
281474976717564	तू रोजे स्कूल जायलस ।
281474976717488	बच्चा जल्दी जल्दी चलत रहे ।
281474976723304	काल ऊ लोग चोर के पकड़ लिहलन ।
281474976725077	राधा गांव में कंही नईखी ।
281474976723333	ऊ लोग अपना-अपना गांवे चल गईलन ।
281474976723388	अब ऊ मैदाने जा तरन ।
281474976718844	सब अदमि के दस रुप्या दऽ ।
281474976726484	कुक्कुरा तऽ लईकवा के रोआ दिहलस ।
281474976725819	हम काल बिद्यालय ना आइम ।
281474976723186	छतवा से हरऽ हरऽ पानी गिरऽ ता ।
281474976718928	राधा सुत्त हईं ।
281474976726245	कुकुर भोंकऽ तरऽ सऽ ।
281474976719141	बच्चा चुप मार के सुत्त हऽ ।
281474976717469	उ हमरा से प्यार करेले ।
281474976718791	उ घरे मे हऽ ।
