ID	Transcription
281474976729909	टीटो कैसै गिरो ।
281474976729966	मैं हर दिना चल्त चल्त हैरान है गऊं ।
281474976717958	तुम कल्लि बएै किताब दै दैंगे ।
281474976730085	मै बाएै एक बच्चा दै रऊं ।
281474976730190	राधा रमेस के संग सैर गई ।
281474976717973	बानै दो दिना पैलि बॉक्स खोलौ हतो ।
281474976727137	तुम बाएै रोज किताब देत औ ।
281474976727069	मैंनि बाति कांच टुरबाओ ।
281474976717874	मैंनि खुदए सीसा मिं देखो ।
281474976730102	बे स्कूल जाइ रए एैं ।
281474976729988	कऊ एै जां अंगरेजी आबति एै ।
281474976714344	राधा बित्तई अच्छी एै जित्ती अच्छी रूबी एै ।
281474976717839	मोइ ना पतौ ।
281474976717792	मेई भैन निऊ मेऔ विश्वास ना करौ ।
281474976727042	बारिश है रई एै ।
281474976730158	मैं नाब ति आयौ ऊं ।
281474976729902	बु एक अध्यापिका थी ।
281474976727133	आस पड़ोस ति सबई लोग सभा के लएैं पौंच चुके एैं ।
281474976729995	बु चामल खाबैगौ ।
281474976726988	बु तीन सूअर घन्नि के पीछि रख्खतु एै ।
281474976726871	पत्तियां पेड़ पै सि नींचि गिर रईं एैं ।
281474976717790	बु घर में एै ।
281474976717927	नीचि दए उधारन कौ प्रारूप बताऔ ।
281474976717642	आया नि लला कूं खानौ खबायो ।
281474976730095	बु राधा ई एै जो खाबैगी ।
281474976717986	बई बीमारी के बारे में कछू न करौ जाइ सकतु ।
281474976727174	कोई अपए आप की तारीफ ना कत्तु ।
281474976717832	मैं बए एक छोरा दै रऊं ।
281474976717915	बे अंग्रेजी बोन्त एैं ।
281474976730124	तुमै कितनी गईआ चइएैं ।
281474976729967	बु बिना कऊ एै बताइ कि चलौ गऔ ।
281474976717846	बु हसत हसत पागल है गई ।
281474976714316	राधा ने अभी घर छोद्दऔ ।
281474976717969	मे मूंड मि दद्दु एै ।
281474976717733	तुम कल बजार गए थे ।
281474976717783	तुम बएै रोज छोरा देओ ।
281474976727004	हम अब बजार जाइ रए ।
281474976718005	नैक चाय बाएै लेओ ।
281474976727045	बु बाएै किताब दैबैऔ ।
281474976730076	मैनि ना खायौ ।
281474976714376	तू दफा है जा ।
281474976726985	बु तेज दौड़ति एै ।
281474976717953	मैं बएै रोज किताब देतूं ।
281474976717709	मैं नाब ति आऊं ।
281474976714336	हम कऊं जाइ सकत एैं ।
281474976717721	कल्लि जा समै तक बु कलकत्ता पौंचि गई होगी ।
281474976726898	किसान कुदाल उदाल लैकि खेतन पै जाइ रऔ एैं ।
281474976730022	तुम अबै न जाइ सकत ।
281474976729979	घुसिए मति ।
281474976717825	बु कल्लि दस बजे सबेरे नईं होगो ।
281474976717727	तुम बएै छौरा दै रए औ ।
281474976727056	चले जाऔ ।
281474976714354	मैं बाएै कल्लि किताब दुंगौ ।
281474976714357	बु छत्ति पै भाजि गई ।
281474976717700	मोइ आम अच्छौ लगतु एै ।
281474976730137	बु घर में औ ।
281474976717931	राजा नि अपओ घरु कल्लि छोड़ो ।
281474976727092	मैं बाए कल्लि एक बच्चा दुंगो ।
281474976729954	मौंडा सोइ चुकौ एै ।
281474976727210	मोइ नैक चॉकलेट दै देओ ।
281474976727216	कौन खुद की प्रसंसा कत्तु एै और जो खुद की प्रसंसा कत्तु एै ।
281474976729975	सब घरन मि जाइ कि हमनि जलामन इकट्ठे करे ।
281474976727060	बु सई ना बोल रऔ है ना ।
281474976717799	मेई अम्मा नि मोइ भौत सारे बिसकुट दए ।
281474976717967	बिन लोगन्नि अपने बारे मि मोइ बताओ ।
281474976727208	छोरा स्कूल जाइ रऔ एै ।
281474976727128	बे बांस काटि रएैं ।
281474976717660	मैंई मम्मी धीरे-धीरे खानौ खाति एै ।
281474976729953	राधा नि नाचौ गाऔ और मेहमान नि मनोरंजन करो ।
281474976717851	टीटो कैसि गिरो ?
281474976726877	बानि थोड़ी देर पैलि ईं तौ चाबल खाए ।
281474976729929	आजु सोमबारु एै ।
281474976730151	कछू लड़का कक्षा मिं ना आए ।
281474976717835	मेई भैनि विद्यालय मिं एैं ।
281474976729896	किसान फांमरौ खुरपी लैकि खेत मिं जातु एै ।
281474976717719	मैं बाएै कल्लि किताब दैंगौ ।
281474976717861	बु गाइ ना सकति ।
281474976729868	मैं कल बाएै बच्चा दुंगौ ।
281474976729866	बु सिर्फ बई के परिबार के लएै काम कर्रई एै ।
281474976727048	राजा की बजै ति बु मरि गऔ हतौ ।
281474976730034	बे जने मोति प्यार कत्त/कत्ति एैं ।
281474976730163	मैं जां तुमैं देखिबे आयौ ऊं ।
281474976730087	खुल कि अगर बोलू तौ मोइ चाइ अच्छी ना लगति ।
281474976727155	नैहर मि पाईं नांइ ।
281474976730048	को को जंगल जाबैगौ ।
281474976727125	सूर्य पूरब मि निकत्तु एै ।
281474976717782	मैं कल्लि दार्जिलिंग जांगो ।
281474976717731	कल्लि बानि कछू ना खाओ ।
281474976727202	राजा नि अपनी बीवी कूं फूल दऔ ।
281474976730180	बे चल दे हते ।
281474976727030	बे चले गए होंगे ।
281474976727027	मैं रोज मैदान जातूं ।
281474976727066	जां बीडी पीबौ मनैं एैं ।
281474976727012	मेरी मम्मी धीमि धीमि खानौ खाति एैं ।
281474976717693	बानि थोड़ी देर पैहले ई चामर खाए एैं ।
281474976730084	आस पास ति और दूर दूर ति सब जने सभा के लएैं पौंचे ।
281474976726904	मैं कल्लि बाएै बच्चा दुंगो ।
281474976717962	बे स्कूल जाइ रएैं ।
281474976729915	भारत मिं सबन्ति लंबी नदी गंगा एै ।
281474976717997	का तू अबई आइ सकतु एै ।
281474976726895	मैं अब बाति नईं मिलुंगो ।
281474976727204	बु बोली कि औरत धत्ती पै सोइ रई एै ।
281474976717892	राधा सीता ति बोली एै राखी खुद एै पसदं कत्ति एै ।
281474976730026	बु कौन एै ।
281474976714349	मैं चाह्तू कि तुम एक अच्छे इंसान बनौ ।
281474976727124	बु सोइ रऔ एै ।
281474976714339	मजूर कूं घर बनबाइबे के लएैं 50 पत्थर की जरूअति एै ।
281474976727108	बु चाबल खाबैऔ ।
281474976714317	राधा सोइ रई एै ।
281474976714338	मोइ भूक लगी एै ।
281474976717804	बु एक अध्यापिका ई ।
281474976717957	कल्लि सबेरै बु जंगल जाइ रऔ होगौ ।
281474976717697	बु धीरैं चन्तु एै ।
281474976727098	बु घूंट घूंट पाईं पी गऔ ।
281474976717822	अगर तू पढ़ाई नईं करैबैऔ तो फेल है जागौ ।
281474976729885	जे दिल्ली जांगे ।
281474976726914	कुत्ता चिल्लाइ रऔ एै ।
281474976717770	बु अबई स्कूल जाइ रई एै ।
281474976717987	आगि भौत तेज लैह्की हती ।
281474976727031	बु लंबौ पेड़ु एै ।
281474976729958	बु घर मेे औ ।
281474976729987	आई नि बच्चएै खानौ खबाओ ।
281474976714350	तुम रात मिं चाबल खंगे ।
281474976717945	बु घत्ति बाहिर गई एै ।
281474976729955	जाऊ ।
281474976717761	बु कल कलकत्ता जाबैगौ ।
281474976714337	सुज्जु पूरब मिं उगत एैं ।
281474976726927	बु मेरि गऔ ।
281474976727021	बानि खानौ खाइ लऔ ।
281474976717928	राधा मिजोरम मि रैह्ति एै ।
281474976727143	टीटू खानौ बनाइ रऔ एै ।
281474976717873	मैं चातू कि बु रोजु खेत मि जएै ।
281474976729856	बु खांस खांस कि मर गऔ ।
281474976717777	मैं हर दिन चन्तु चन्तु थक गऊं ।
281474976717778	मैं बएै किताब दै रऊं ।
281474976717838	तू रोज स्कूल जातु एै ।
281474976717976	हमैं जान देओ और चाय पियौ ।
281474976727010	बु बाएै एक बच्चा दै रऔ एै ।
281474976717882	भूक के माएैं मेऔ अतिरु ककुराइ रऔ एै ।
281474976714333	राजीव टोटौ सबति लंबौ एै ।
281474976729945	टेबिल पै दो किताबै एैं ।
281474976730107	प्रत्ती पेड़न तै नीचि गिर रई एैं ।
281474976727071	साइद बु कल्लि सुबै जन्दी आएै ।
281474976717678	कुत्ता नि बच्चए रुबाइ दऔ ।
281474976727161	बे एक दूसरे एै अंकुरण कर रए एैं ।
281474976717690	लोग जां इकट्ठे भए एैं ।
281474976730043	मैं कबू शराब ना लेतु ।
281474976717841	तेऔ घरु कां इ ।
281474976729847	पिछिले हफता बु दिल्ली जाइ चुकौ औ ।
281474976717954	मोइ एक छोटौ केला दिओ ।
281474976727054	बु कल्लि नगर गओ हतो ।
281474976730062	तुम कल कलकात्ता जांगे ।
281474976717965	कलकत्ता मिं देश की सबन्ति अच्छी मिठाई मिन्ति एै ।
281474976717998	हरीस नि घरु छोद्दऔ ।
281474976730103	मैं जाइ रओ ।
281474976730088	बु बाएै किताब देगौ ।
281474976714359	किबार खोलौ ।
281474976714366	जा नएैं ।
281474976727113	राधा नि मोमि पांऔ मारौ और भाग गई ।
281474976717942	जि बांस और रस्सी एै ।
281474976727085	बिन्नि मोइ फौन करौऔ ।
281474976717655	बे एक दूसरे कौ अनुकरण कत्त एैं ।
281474976727225	बू एक आदिमी कूं देखि रई ।
281474976727140	राधा चाबल धीमि-धीमि खाति एै ।
281474976717888	संख्या ,लिंग और सम्मानसूचक की जांच करि ।
281474976727218	भगबान तुमाऔ भलौ करै ।
281474976727001	सारी लड़की कक्षा मिं आइ एैं ।
281474976727088	तुम बाएै किताब दै रए औ ।
281474976717699	अब हमैं खानौ होगौ ।
281474976717683	मैं चलि ना पाइ रऔ ।
281474976726984	मधू अपए बच्चन ति भौत प्यार कत्ति एै ।
281474976717794	सादी के लएै लड़की को देखो एै ।
281474976717983	कृपया जइओ ।
281474976717961	राधा नि अपए लएै एक धोबती खरीदी ।
281474976729914	बानै स्कूल मिं जाइबौ चौ छोद्दऔ ।
281474976729871	मैंनै बाके भइआ एै देखौ ।
281474976726876	मैं आजु रात को सैहर जांगो ।
281474976727136	कानून नि आदेश करेे एैं कि सराप कूं मस्जिद मंदिर और चर्च के पास पिऔ नइ जाबैऔ ।
281474976730150	सब जने नि परीक्षा पास ना करी ।
281474976727120	सब लोगन नि परीक्षा पास न करि पाई ।
281474976717776	बु चामर खाबैगौ ।
281474976727104	मैंहतो राधा ति लम्बौ एै ।
281474976727182	मैं परिबार मिं मुर्गा और मुर्गी हैं ।
281474976730108	मधू अपने बच्चा एै भौतु प्यार कत्ति एै ।
281474976717659	बु घर किन कौ एै ?
281474976727040	राधा गांम मिं कऊं है हि नांइ ।
281474976717801	मधू अपई भैन ति जादा सुंदर एै ।
281474976730123	कलकत्ता मिं देस की सबन्ति अच्छी मिठाई मिल्ति एै ।
281474976726973	बु कल्लि नगर गऔ हतो ।
281474976730126	मैहतौ तैरने गयौ ।
281474976727123	बु धड़ाम ति गिरौ ।
281474976717724	दरबाजो अपए आप खुलि गऔ ।
281474976730145	मैं बाएै कल्लि किताब दुंगो ।
281474976730204	तुम अबई चामलन एै खाइ रए औ ।
281474976714360	बु को एै ।
281474976730014	कल्लि सबेरि बु जंगल जाइ रऔ होगौ ।
281474976730162	कृपिया जाऔ ।
281474976729938	दरबज्जो अपने आप खुलि गऔ ।
281474976717730	बु घर में होगौ ।
281474976717891	टीटू खानौ बनाइ रऔ ।
281474976730052	तुम भाड मैं जाऔ ।
281474976726948	रूबी सबन्ति तेज धावक एै ।
281474976727198	मोइ पतौ एै कल्ल की छुट्टी एै ।
281474976729905	मैं बजार कूं गए एैं ।
281474976726970	मजदूर कूं घर बनाइबे के लएैं 50 पत्थर की जरूरत एै ।
281474976730029	तुम रोजीना चाबल खातौ ।
281474976714340	बिन लोगन कूं रस्सी ति बांध दो ।
281474976717877	हमाए समूह मि तू सबन्ति अच्छौ इंसानु एै ।
281474976717995	बे दिल्ली जाइ सकत एैं ।
281474976717852	मैं अब बाति ना मिन्तु ।
281474976730071	मैं घर में भौत से पेड़ एैं ।
281474976727103	दफा हो जाओ ।
281474976726979	बू घर बड़ौ एै ।
281474976727166	बानि कमरा एकदम साफ कद्दऔ ।
281474976726912	मैं कबू शराब ना पीतु ।
281474976726874	क्या तुम अबै आ सकत औ ?
281474976727206	तुमाऔ घरु कांइ ।
281474976717666	बएै खेलिबे दै ।
281474976727074	मैं बाएै घत्ति बाहिर लै जाइबौ चातू सोमबार कूं ।
281474976727038	भाड़ मिं जाऔ तुम अब ।
281474976727109	कल्लि जा समै तक बि कलकत्ता पौंच जाई ।
281474976717641	मैंने छोरी ति कामबाई कु कमरा साफ करबाइबे के लएैं कही ।
281474976717902	बु बोली की औरत जमीन पै सोइ रई एै ।
281474976730118	राधे नि घरु छोद्दऔ ।
281474976727173	हमैं तुम आराम नईं करन देओगे ।
281474976730046	चाय पिएैं ।
281474976717941	मजदूर नि एै घरु बनाइबे काजि 50 पत्तथरन की जरूरति एै ।
281474976729993	बु सिक्षक नांइ ।
281474976729912	बिन्नै अपने बारे मिं मोइ बताओ ।
281474976717766	मैंन नईं खाऔ होगौ ।
281474976726891	हमाए सम्बंध मिं तू सबन्ति अच्छौ एै ।
281474976730125	बे जने अपने अपने गांम चले गए ।
281474976717990	तुम बस संख्या 65 लै सकतौ बा कसबा जाइबे काजि ।
281474976730008	मेई मां धीरे-धीरे खानौ खाति एै ।
281474976730006	तुम बाएै रोजु बच्चा देओ ।
281474976717806	साइद आज मंत्री जी नईं आंगे ।
281474976717821	अगर अच्छौ पानी परौ तौ अच्छी खेती होगी ।
281474976729848	बानै मोइ फौन करो ।
281474976730185	कोई बच्चा ना आयौ ।
281474976727016	मैं बा पै ना जा सकतु ।
281474976726991	हमैं जान देओ ।
281474976729959	बानै कपड़ा साफ करौ ।
281474976729994	बानि पत्थर तोद्दऔ ।
281474976717974	बेर बेर बएै भूत दिखो ।
281474976727195	बाकी बीमारी के बारे में तो कछू ना कऔ जाइ सकतु ।
281474976730050	कुस्सी बच्चन ने तोरी एै ।
281474976726917	जहां तहां किताब फैलाइ रख्खी एैं ।
281474976717886	बानै पत्थर तोड़ि दओ ।
281474976727106	सबन्न ए घर मिं एक कुत्ता एै ।
281474976714364	बानि एकु आदिमी देखौ ।
281474976717815	मैं गिरि गओ जब एक कार नि मोइ टक्कर माद्दई ।
281474976727165	मे अगल बगल मि सब अच्छे एैं ।
281474976727180	तुम कल्ल कलकत्ता जाऔगे ।
281474976717637	बु बएै किताब देतु एै ।
281474976717898	बु दुपैर मि गाबैगौ ।
281474976730012	नदी मि पाई नाइ ।
281474976717652	दरबाजे कौ सीकडी टूटौ एै ।
281474976727183	बानि कल्लि कछू ना खाऔ ।
281474976727003	हम तुमैं परेसान नईं करिंगे ।
281474976726903	तुम बस संख्या 65 लै सकतऔ कस्बा जाइबे के लएै ।
281474976718002	बानि खानौ खाइ लऔ एै ।
281474976718000	तुम किनै पसंद कत्त एैैं ।
281474976727014	बिन्नि अपऔ काम ना खतम करो ।
281474976730027	मैं कल दार्जीलिंग जांगो ।
281474976726980	बू जंगल मि एैं ।
281474976727025	कृपया जाऔ ।
281474976717933	बु शिक्षक ना रही ।
281474976730072	जाऔ और देखौ ।
281474976717654	मैंहतो राधा ति लंबौ एै ।
281474976717970	कृपया जा ।
281474976730141	बु आयौ बैठौ खायौ और चलौ गऔ ।
281474976717911	सब छोरिन मि सबन्ति सुंदर एै ।
281474976727209	बे सब पास ना भए ।
281474976730060	मैं चातू कि बु रोजु खेत जाएैं ।
281474976727024	बु छत्ति पै भाग गई ।
281474976730039	तुमाऔ नाम का एै ।
281474976729894	दरबाजौ खोलौ ।
281474976726971	दरबज्जौ खोलौ ।
281474976727036	तुम अब जाइ ना सकत ।
281474976717791	तू बएै किताब दै रऔ एै ।
281474976726931	हमैं विद्युत तारन ई जरूरत एै ।
281474976717840	पिछिले सप्ता बे दिल्ली जाइ चुके एैं ।
281474976726892	खुलि कि बोलूं तौ मोइ चाइ पसंद नांइ ।
281474976727094	मैं बाएै एक किताब दै रऊं ।
281474976717913	राधा नै नाचौ गाऔ और मेहमानन कौ मनोरंजन करो ।
281474976729942	राधा बितनी अच्छी एै जितनी रूबी ।
281474976730042	मैं बाएै किताब दे रऊं ।
281474976726954	बानि बाएै एक बच्चा दओ ।
281474976730083	मोइ नैक चौकलेट देओ ।
281474976726959	बु घत्ति भार गई ।
281474976727049	मैं नाब ति आंऊ ।
281474976717871	मैंनि अबई तकि ना खाऔ ।
281474976729906	बे रोज बजार जात एैं ।
281474976730066	बु कल्लि नगर गयौ ।
281474976729968	हमैं अबई आराम मत करन दिओ ।
281474976717680	मैं कबऊ सराब ना लेतु ।
281474976717698	राधा एै कितने रुपइआ मिले ।
281474976730015	मोइ एक दज्जन केला दै देओ ।
281474976730139	बाकौ नाम किसना एै ।
281474976717771	चलौ जा ।
281474976717651	आजु पानी परैऔ ।
281474976729854	निकल जंन्ति ।
281474976717944	बु उछलि -उछलि कि अपए घर पौंचैगौ ।
281474976729846	मोइ जान देऔ ।
281474976727067	घरै घरै जाइकि हमनि जलाबन इकट्टठौ करो ।
281474976726925	बु मास्टर नांइ ।
281474976717711	टैंक मि पानी नाइ ।
281474976717645	राधा उतनी अच्छी एै जितनी कि रूबी ।
281474976729983	बु बाएै किताब दै रओ हतो ।
281474976717919	मम्मी नि आया ति बच्चन एै खानौ खब बाऔ ।
