ID	Transcription
281474976717745	हम अब एक मेला मि जाइ रएैं ।
281474976729884	बे सोइ गए हते ।
281474976717907	मैं रोज मैदान कूं जातूं ।
281474976729886	तुम रात मिं चामलन एै खाऔगे ।
281474976717971	मैं चाह्तूं कि तू एक अच्छौ इंसान बनै ।
281474976730004	खराब मौसम की बजै ति हम गाम नईं जाइ पाए ।
281474976729883	जि गाडौ लालि एै ।
281474976730182	तुमऔ घरु कौन सौ एै ।
281474976726918	मे घर मिं भौत से पेड़ एैं ।
281474976729863	जि लम्बौ पेडु एै ।
281474976726885	मोइ जि काम करन देओ ।
281474976717988	हमन्नै सबेरि चामर बनाए ।
281474976730122	मोइ नां पतौ ।
281474976717968	राजा और राधा एक दूसरे कूं देखीओ ।
281474976727211	बानि बाए एक छोरा दओ हतो ।
281474976730214	बु कल्लि तक अपऔ काम खतम कच्चुकौ होऔ ।
281474976714358	बु कल्लि तकि अपऔ काम कच्चुकौ होइऔ ।
281474976727075	का तुमनि अपऔ काम करौ नांइ ।
281474976726929	मैंनि जि नां कई कि बु खराबु नांइ ।
281474976726990	भूक से मेरा अतरि कुकर रहा है ।
281474976729920	बु कलकत्ता ति आबैगी ।
281474976727200	मे सिर मि दर्द है रऔ एै ।
281474976717925	कल्लि बु राति मिं चामर खाबैगौ ।
281474976726906	कल्लि बानि राति मिं चाबल खाए ।
281474976726951	मधू अपनी भैन ति जादा सुंदर एै ।
281474976729911	मैंनि अबई तकि खानौ नईं खाऔ हतो ।
281474976729934	बु दूदु फूदु खरीदैगी ।
281474976717870	सब छोरियां कक्षा मि आंइ एैं ।
281474976717653	का तैनि अपनौ काम करौ नाइ ।
281474976729851	साइद बु कल्लि सबेरि जल्दी आबैगौ ।
281474976727119	बु रोज स्कूल जातु एै ।
281474976714327	मैंनि बाकौ मूडु खच्च ति काटि दऔ ।
281474976726919	जो मौटा एै ।
281474976717664	पिछले साल अक्टूबर मि बारिस भई ।
281474976717675	राधा बितनी ई अच्छी एै जितनी कि रूबी ।
281474976717951	राजीब टोटो सबन्ति लम्बौ एै ।
281474976726870	हम कहूं भी जा सकत एैं ।
281474976729941	बानि हाती एै मारिबे ई कोसिस करी ।
281474976729913	जइंयौ ।
281474976726969	बे अपए अपए गांव चले गए ।
281474976717723	बु कल कलकत्ता जागौ ।
281474976730120	बाकी बीमारी के बारे मिं खछू ना करौ जाइ सकतु ।
281474976729946	मोइ पतौ एै कि कल्लि छुट्टी एै ।
281474976729950	राधा चामल धिमि खा ।
281474976714353	बानि मोइ आसीर्बाद दऔ ।
281474976714325	राधा नि चाबल धीरि खाए ।
281474976726958	बु बाएै रौज बच्चा देतु एै ।
281474976727086	यदि अच्छौ मेऔ बस्सि गऔ तौ खेती अच्छी होई ।
281474976717676	मैं दोस्त की भैनि बीमार एै ।
281474976727087	बु दिल्ली अकेली जाइ सकति एै ।
281474976714351	बाकौ नाम कृष्णा इं ।
281474976726967	मैं चाबल और सब्जी खाइ रऊं ।
281474976717859	बु खांसि खांसि कि मरि गऔ ।
281474976717665	चाय पीबत एैं ।
281474976726924	मोइ आम अच्छे लगत एैं ।
281474976730010	बु सोइ गई थी ।
281474976729944	तुम कल्लि बाएै किताब दै दोगी ।
281474976727134	मैं तौ तैरिबे लगौ ।
281474976714330	मोइ काऊन्न देखौ ।
281474976727100	बानि देखौ कि बे लोग पत्थर ति खेल रएै ।
281474976718004	बु राधई एै जो खाबैगी ।
281474976727127	पिछिले सपता बे दिल्ली जाइ चुके हते ।
281474976717856	हर घर मि एक कुत्ता एै ।
281474976730075	बे अब बांस एै काटि रए एैं ।
281474976727223	बु खांस खांस कि मरिगऔ ।
281474976727186	बू कल्लि कलकत्ता जाइ रई एै ।
281474976726998	तुमनि बाएै बच्चा दओ हतो ।
281474976726945	मि और भइआ साथ मिं खेलिंगे ।
281474976729877	मैनि जि ना कऔ कि बु खराबु नाइं ।
281474976730003	मे पास पईसा न होत तौ मैं चल सकातूं ।
281474976729882	तुमन्नै सबेरि चामल खाए ।
281474976726901	यह गाड़ा लाल है ।
281474976727023	बु रोजु स्कूल जातु एै ।
281474976730110	संख्या लिंग और सम्मान सूचक की जांच करौ ।
281474976727076	बानी हांती मारिबे की कोसिस करी ।
281474976717743	अगर मैं आइ पाबतौ ।
281474976727059	तुमनि बाएै देखौ एै कि नांइ ।
281474976727178	बे हसते हसते पागल है गई ।
281474976727007	खाइबे बाद सोऔ ।
281474976729981	का मैं तोइ काल्लि बुलाइ सकतूं ।
281474976726896	बिनैं तुम रस्सी ति बांध देऔ ।
281474976729903	मैं मां नहीं जाइ सकतो हतो ।
281474976730109	कल्लि रात मिं बु चामल खाबैगौ ।
281474976730174	चले जाओ ।
281474976717667	हम लोगन्नि एै बिद्दुत तार ई जरूरति एै ।
281474976717864	राधा चामर धीरे खाई ।
281474976727011	रूबी राधा ति लंबी एै ।
281474976717865	हमति बिना पूछे प्रबेस मति कद्दिओ ।
281474976717779	बु कल कलकत्ता ति आबैगी ।
281474976726864	भारत मिं सबन्ति लम्बी नदी गंगा है ।
281474976730030	मे माथे मि द्दु एै ।
281474976717950	सब लोग जोरि नाइ ।
281474976726886	मैं उसे रोज किताब देतूं ।
281474976717816	मोइ न लगतु बु आबैऔ ।
281474976729940	मैं जोत्ति भाजी ।
281474976717760	खराब मौसम की बजै ति हम गांम मि ना जाइ पाए ।
281474976727187	तुम बाएै कल्लि किताब दै देओगे ।
281474976727064	का मैं तुमैं कल्लि बुलाइ सकतूं ।
281474976717803	टीटू की मां नि टीटू ति राधा कूं सुल बाऔ ।
281474976727032	बु एक मास्टरनी एै ।
281474976717975	बु फुटबॉल हर रोजु खेन्तु एै ।
281474976727227	को को जंगल मिं जाबैऔ ।
281474976717885	बु एक अध्यापिका एै ।
281474976717818	बु कल्लि ति अपऔ काम कल्लेगौ ।
281474976726968	मैं अब मैदान जाइ रऊं ।
281474976727196	मैं जांगो तब मम्मी आबैईं ।
281474976727179	बे बाएै किताब दै रए हते ।
281474976726934	बु मैदान जाइ रऔ एै ।
281474976730153	बु एक आदिमी एै देखी ।
281474976717991	तुम अबई चामर खाइ रए ओ ।
281474976730019	राधा गाम मि कबऊ नां आति ।
281474976730016	नैक चाइ फाइ लेओ ।
281474976727017	बानि गेंद कूं मारौओ ।
281474976727097	राधा उत्ती अच्छी एै जितनी रूबी अच्छी एै ।
281474976727191	राजीव टोटो सबन्ति लंबो एै ।
281474976730051	हमाए समू मिं तुम सुबनतै अच्छे इंसान औ ।
281474976727096	कृपया किबार खोलीऔ ।
281474976727055	मैंनि अबई तक नां खाऔ ।
281474976727132	छति तै हर हर पानी गिर रऔ एै ।
281474976714334	संख्या पुरुष की और समाज सूचक की जांच करौ ।
281474976727172	मैं सबेरि चाबल खाए हते ।
281474976727224	मोइ काऊन न देखौ ।
281474976717918	हमै अब आराम मत करन दै ।
281474976727072	मैं जाइ रऊं ।
281474976717929	मैं खानौ नई खांगो ।
281474976729982	मैं जांगो जब मइयो आइ जागी ।
281474976717692	राति मि चामर खांगे ।
281474976717935	यां तां किताब बिखरी डरी एैं ।
281474976727151	राधा मिजोरम मिं रैह्ति एै साइद ।
281474976717752	राधा नि मोइ पांइ ति मारो और भाजि गई ।
281474976730210	कृपया दरबज्जौ खोलौ ।
281474976717737	बे चन दए होते ।
281474976729880	हरीस नैं घर छोद्दऔ ।
281474976727154	बु घर मिं होइओ शाइद ।
281474976726910	जाऔ और देख कि आऔ ।
281474976717718	राजू नि घर छोड़ि दऔ ।
281474976729933	मैनि मोडी एै काम बाई ति कमरा साफ करिबे के लएै बोलौ ।
281474976714323	बुअ दूदु बूदु खरीदैई ।
281474976717923	मैं बएै कल्लि छोरा दैंगो ।
281474976727090	मम्मी नि आया से बच्चन कूं खानौ खिलबाओ ।
281474976730152	हम तुमै परेसान नईं करिंगे ।
281474976729923	मधू बाकी भैन ति जादा सुंदर एै ।
281474976726953	तुम मे संग चलि रए औ न ?
281474976717732	कोई अपई तारीफ ना कत्तु ।
281474976717849	मैंनि बएै भइअएै देखो ।
281474976726989	बु खाना खाइबे के बादि सोइबे चलो गओ ।
281474976729907	टंकी मि पाईं ना हतु ।
281474976726994	बजार गऔ एै ।
281474976717985	मेज पै दस किताबै एैं ।
281474976726950	जि सई रैह्बै तुमाए लएैं ।
281474976717769	तैंनि सबेरै चामर खाए ।
281474976717788	तोइ एैसि नईं बतानौ चइएैं ।
281474976727081	बु बिना बताए चलौ गऔ ।
281474976730089	तुम बाएै बच्चा दै रए औ ।
281474976730187	बिन्नि हमैं आर्सीबाद दओ ।
281474976726983	टेबल पै दो किताबै एैं ।
281474976727189	मैं चाह्तू कि तुम एक अच्छे इंसान बन जऔ ।
281474976727207	थोड़ौ चाइ वाइ पी लेओ ।
281474976726944	मौइ लगति एै बु नईं आबैऔ ।
281474976714348	बु मोति प्यार कत्ति एै ।
281474976727095	बानि सगाई तोड़ दई ।
281474976717869	कल कलकत्ता जांगे ।
281474976729887	रुबी राधा ति लम्बौ एै ।
281474976717810	बे अब बांसु काटि रएैं ।
281474976730090	आंच भौत तेज लगी हती ।
281474976717903	मैं रादा ऊं ।
281474976717948	रूबी सबन्ति तेज धाबक एै ।
281474976727008	बु घर में ई एै ।
281474976717686	तुम अब नईं जाइ सकौ ।
281474976714355	जि बांस की रस्सी एै ।
281474976726982	मैं सिर्फ चाबल खांगो ।
281474976730203	कोई खुद की तारीफ ना कत्तु ।
281474976727020	बु सोइ गई ।
281474976717999	राधा नै अबई अबई घरु छोड़ौ एै ।
281474976726946	कुस्सी बच्चन्नि तोड़ दई ।
281474976729936	कुतन्नै बच्चएै रुबाइ दऔ ।
281474976727101	राधा और राजा नि एक दूसरे कूं देखौओ ।
281474976726949	मैं आज नईं खेलौओ ।
281474976727193	बु कपड़ा धुल रई एै ।
281474976714371	जामिं आइ पातऔ ।
281474976729935	बु एक ।
281474976717917	बु बएै किताब देगो ।
281474976717707	रूबी राधा ति लंबौ एै ।
281474976726928	बु राधा एै जो खाबैई ।
281474976730031	मोइ नां लगतु बु आबैगौ ।
281474976729890	राजा नै अपनी पत्नी एै फूल दऔ ।
281474976730186	हम अब मेला मि जाइ रए एैं ।
281474976714331	अपऔ खानौ खाइबे के बादि बु सोइबे चलौ गऔ ।
281474976727170	मैं स्कूल नईं जांगो ।
281474976717926	साइद बु कल्लि सुबै जन्दी जएै ।
281474976727126	मैं राधा हूं ।
281474976726922	मोइ चाबल बाबल देओ ।
281474976730007	तुम बाजार जाइ रए औ ।
281474976729855	नीचै दए गए उदाहरण कौ प्रारूप बताऔ ।
281474976714380	मेज पै दस किताबें एैं ।
281474976730147	मैं चाहतौ कि तुम एक अच्छी इंसान बनौ ।
281474976714373	बु बिना काऊ बताएं चलौ गऔ ।
281474976730017	भूक ति मेई आंतमा ककुराइ रईं एैं ।
281474976717867	सीता और राजा एै लगतु एै बे एक दूसरे ति लड़ि रएैं ।
281474976727110	बानि पत्थर तोड़ दऔ ।
281474976727079	हर आदिमी कूं 10 रूपइआ देओ ।
281474976717688	मोइ काऊ नि न देखो ।
281474976717939	मोइ ना लगतु बु आबैगौ ।
281474976727145	बे अब घर पै हुंगे ।
281474976727065	तुम मोइ जान्त औ कि नांइ ।
281474976727217	बु दुपैर मि गाबैऔ ।
281474976729996	मैं एैंतबार कू कलकत्ता जांगो ।
281474976729895	मै बाए धत्ति बाएै लै आनौं चातूं सोमबार कूं ।
281474976727160	का तुम कल्लि जां पै आइ सकतऔ ।
281474976729864	बु घर मिं ।
281474976717848	बु बएै एक छोरा देतु एै ।
281474976717982	दरबाजौ खोलीओ ।
281474976717722	बु बएैं एक छोरा दै रऔ एै ।
281474976717894	बु बएै किताब दै रओ एै ।
281474976714368	बु मरिगौ ।
281474976726999	तुम कल्लि सैहर गए हते ।
281474976727058	बानि शादी के लएैं एक लड़की कूं देखौओ ।
281474976717937	हम अब बजार जाइ रएैं ।
281474976717720	तुम बएै रोज किताब देत एैं ।
281474976717955	काऊ एै जां अंग्रेजी आबति एै ।
281474976730179	बु भौतु ई मधुरमै गाति एै ।
281474976717704	क्या ?
281474976717784	तेऔ नाम का एै ।
281474976726972	बु दूध बूध खरीदैई ।
281474976726872	मैं कल्लि डारजीर्लिंग जांगो ।
281474976714367	कुत्ता नि बाली बच्चा कूं रुबाऔ ।
281474976727188	लोग जां पै इकट्ठे भए एैं सब ।
281474976714379	का तैनि अपऔ काम नइ करौ ?
281474976727203	बू ना गाइ सकति ।
281474976729860	राधा सीता कूं बोली कि राखी खुद एै पसंद कत्ति एै ।
281474976717744	तेओ घरु कौन सो एै ।
281474976714346	राधा नि अपऔं घरु कल्लि छोड़ि दऔ ।
281474976717940	बच्चा स्कूल जाइ रएैं ।
281474976727185	तुम अब हिलिऔ मति ।
281474976730040	बानै कल्ल खछू नई खायो ।
281474976726943	बू घर किन कौ एै ।
281474976730194	का तुमन्नै बाएै देखौ एै । नांइ ?
281474976727026	सीता और राजा कूं लगौ कि बे एक दूसरे ति लड़ि रए एैं ।
281474976726995	मैंनि लड़की पै झाड़ू ति कमरा साफ करबाओ ।
281474976717878	मैंनि कल्लि नईं खाऔ हतौ ।
281474976730202	बु हमाए संप्रदाय को मुखिया एै ।
281474976717847	मे पास पइसा नईं होते तौ मैं चन सकतो ।
281474976730033	जाऔ और पके भए कछू फल लैकि आऔ ।
281474976717705	कछू लड़का क्लास में ना आए ।
281474976717808	मैंनि बाति कांच तुड बाओ ।
281474976726932	हमनि खुदकू शीशा मिं देखौ ।
281474976717670	छाञ एै छडी ति न पीटै ।
281474976730117	मैनि बा कौ सिर खच्च ति काटि दऔ ।
281474976717820	बिन लोगन्निएै डोरी ति बांध दै ।
281474976727162	बानि कुल्हाड़ी ति पेड़ काटि दऔ ।
281474976729881	हम एक मेला मिं जाइ रए एैं ।
281474976717763	बानि गेंद एै मारो ।
281474976729986	अगर तुम पढ़ाई नईं करिंगे तौ फेल है जांगे ।
281474976717712	बु दिल्ली जांगे ।
281474976717643	जि गाडौ लाल एै ।
281474976730025	का तुमन्नै अपनौ काम ना करौ ।
281474976727175	हमनि पत्थर ति घर बनाए एैं ।
281474976717656	मैंहतो तैरिबे चलौ गऔ ।
281474976727138	काऊ एै जां अंग्रेजी बोलिबौ आति एै ।
281474976717922	मैंनि वकौ मूडु खच्च ति काटि दऔ ।
281474976727194	अगर मेओ बस्सेऔ तो मैं मुर्गा बनाऊंगो ।
281474976730037	दरबज्जे की सिकडी टूटी एै ।
281474976714363	कछू लोंडा कक्षा में नएै आए ।
281474976729984	बु घर किन को एै ।
281474976730140	तुमाऔ घरु कां एैं ।
281474976717749	बु घुट घुट पानी पी गऔ ।
281474976730207	बानि थोरी देर पैलि ई चामल खाए एैं ।
281474976717681	पानी पर रऔ तासू मैं खेत मि ना जाइ पाऔ ।
281474976730099	बु कल नगर गयौ ।
281474976717860	मैनि सबेरि चामर खाए ।
281474976714329	हम दौनौं जने एक दूसरे ति मिले ।
281474976726963	मेज पै 10 किताबैं एैं ।
281474976717649	बु नीचै गिर गई ।
281474976717696	जि लंबौ पेड़ु एै ।
281474976729852	मोइ लगतु एै बु नईं आबैगौ ।
281474976727171	कलकत्ता मिं देस की सबन्ति अच्छी मिठाई मिन्ति एै ।
281474976729891	बु कपडा धोइ रई ।
281474976727033	राधा कूं कित्ते पइसा मिले ।
281474976717780	कृपया जऔ ।
281474976727158	हमैं जान देओ और चाय पी लेओ ।
281474976717725	मे मूड मि दर्दु है रऔ एै ।
281474976717658	यां धूम्रपान मना एैं ।
281474976726894	मैं कल्लि स्कूल नईं जांगो ।
281474976730101	राधा बितनी अच्छी एै जितनी कि रूबी ।
281474976726992	ना मैं और ना तू जा परेसानी एै हल कस्सकत ।
281474976717647	नदी मिं पानी नाइ ।
281474976726869	वह बांस की रस्सी है ।
281474976717912	अगर पानी परैओ तो मैं चिकिन बनांगो ।
281474976717812	मुोइ जान देओ ।
281474976730181	मेई अम्मा नै मोइ भौत से बिस्कुट दए ।
281474976714328	मोइ न पतौ ।
281474976729889	राधा नि मोइ पैत्ति मारौ और भाग गई ।
281474976730032	मै बाएै कल बच्चा दुंगो ।
281474976727167	तुम अबै चाबल खाइ रए औ ।
281474976726978	मोइ जान देओ ।
281474976730196	मैं राधा ऊं ।
281474976730058	सब जने पास ना भए ।
281474976727041	रमेश दौड़ौऔ ।
281474976717930	बु आऔ बैठौ खाइ कि चलौ गऔ ।
281474976726916	तुमाऔ घरु कौन सौ एै ।
281474976730009	हम अब बाजार जाइ रए एैं ।
281474976729949	मैंने सबेरि चांमल खाए ।
281474976726939	का तू घर जाओ ।
281474976717736	रमेस दौड़ौ ।
281474976726926	अगर तुम पढ़ौए नईं तौ फेल है जाऔगे ।
281474976730115	मेऔ पर रओ जा कारड मैं खेत मिं ना आइ पाऔ ।
281474976717900	मैंनि छोरी ति झाड़ू ति कबरा साफ करबाओ ।
281474976717887	मोइ एक दर्जन केला दिओ ।
281474976730077	जां धूम्रपान निषेध एै ।
281474976717695	खुस्सी बच्चने तोड़ी एै ।
281474976717786	का मैं कल तोइ बुलाइ सकतूं ।
281474976729869	कृपा करके जाऔ ।
